Name,Rating,NumberOfUser,Address,lat,lon,X
Nasi Goreng Mas Alimun,4.0,11,"Jl. Pancoran Bar. XID No.23, RT.6/RW.3, Pancoran, Kota Jakarta Selatan",-6.244100700000001,106.83649409999998,44.0
Warung Nasi Goreng Lesehan Solo,4.0,11,"Pondok Betung, South Tangerang City",-6.2675122000000005,106.74609170000001,44.0
nasi goreng kang udin cirebon,4.4,10,"Jl. RS. Fatmawati Raya No.222E, RT.5/RW.10, Pd. Labu, Kota Jakarta Selatan",-6.3077568999999984,106.7930407,44.0
Nasi Goreng Tombo Ati,4.4,10,"Jl. Melati I No.1, Gandul, Kota Depok",-6.341526,106.79429499999999,44.0
Bang Irin Fried Rice Shop,4.8,9,"Jl. Pengadegan Utara, RT.11/RW.6, Pengadegan, Kota Jakarta Selatan",-6.246931200000001,106.8500514,43.199999999999996
Nasi Goreng Tetep Segar Pak De Mamat,4.8,9,"Jl. Raya Pasar Minggu No.43, RT.6/RW.7, Ps. Minggu, Kota Jakarta Selatan",-6.282297199999999,106.8445142,43.199999999999996
susu jahe merah mas agung ( RGM,4.8,9,"Jl. H. Daud, RT.2/RW.3, Sukabumi Sel., Kota Jakarta Barat",-6.2237905,106.7731067,43.199999999999996
Nasi Goreng Sumawe,4.8,9,"Jl. Kyai H. Syahdan No.16A, RT.7/RW.12, Palmerah, Kota Jakarta Barat",-6.2008158,106.78444250000001,43.199999999999996
Nasi Goreng Mas Gondrong,4.8,9,"Gg. Bandrong, RT.12/RW.11, Kalisari, Kota Jakarta Timur",-6.3372957,106.8536476,43.199999999999996
Nasi Goreng Selera Rakyat 2,4.8,9,"Jl. Duren Tiga Selatan No.34, RT.8/RW.2, Duren Tiga, Kota Jakarta Selatan",-6.2588162999999986,106.83802709999999,43.199999999999996
Nasi Goreng Mas Dul,4.8,9,"Jl. Tekukur, Rengas, Kota Tangerang Selatan",-6.2814983999999985,106.7537259,43.199999999999996
Nasi Goreng Dukhri,4.8,9,"Taman Jajan Tanjung Barat Indah, RT.3/RW.2, West Tanjung, South Jakarta City",-6.3048793,106.84744340000002,43.199999999999996
Nasi Goreng Gila Pak Prio,3.9,11,"Jalan H. Muchtar, Kreo, Larangan, Kreo, Kota Tangerang",-6.2254584999999985,106.7378489,42.9
Nasgor Bagrig,3.9,11,"Jl. Jambu II No.34, RT.7/RW.2, Cipedak, Kota Jakarta Selatan",-6.3595320000000015,106.8030803,42.9
Nasi Goreng Mbah Jarot,3.9,11,"Jl. Batu Ampar 1 No.5, RT.4/RW.4, Batu Ampar, Kota Jakarta Timur",-6.2727862000000005,106.8600132,42.9
Nasi Goreng Anek Racik Menteng,4.7,9,"Jl. Menteng Sukabumi Gg. 2, RT.10/RW.3, Menteng, Kota Jakarta Pusat",-6.2060685,106.8419844,42.300000000000004
Nasi Goreng Bang Ipan 96,4.7,9,"Jl. Pinang Raya No.RT 01/014, Pamulang Tim., Kota Tangerang Selatan",-6.357620400000001,106.73821140000001,42.300000000000004
Warung Nasi Goreng Kemang,4.7,9,"5, Jl. Kemang Utara No.5C, RW.1, Bangka, Jakarta",-6.2573091,106.8162274,42.300000000000004
Nasi Goreng Parjo,4.7,9,"Jl. Srengseng Sawah No.27, RT.6/RW.6, Srengseng Sawah, Kota Jakarta Selatan",-6.345789900000001,106.82602490000001,42.300000000000004
Nasi Goreng Padang Betra,4.7,9,"Jl. Yusuf No.9, RT.4/RW.11, North Sukabumi, West Jakarta City",-6.2072525999999995,106.7799253,42.300000000000004
Warung Nasi Goreng PodoMoro Mas Slamet,4.2,10,"Jl. Tj. Bar. Lama No.129, RT.8/RW.4, Tj. Bar., Kota Jakarta Selatan",-6.301495500000001,106.8411747,42.0
Nasi Goreng Abah Yahya,4.2,10,"Jl. Ceger Raya, RT.3/RW.2, Pd. Karya, Kota Tangerang Selatan",-6.2599957999999996,106.74598909999999,42.0
"Nasi & Mie Goreng ""Partai Lezatto""",3.8,11,"West Pamulang, South Tangerang City",-6.3595571,106.73551780000001,41.8
Nasi Goreng Yasmin Racing,4.6,9,"Jl. Merpati Raya No.7, Sawah Lama, Kota Tangerang Selatan",-6.2960064000000004,106.7343919,41.4
Nasi Goreng Pohon Jambu,4.6,9,"Jl. Perintis Blok Kamboja No, RT.9/RW.2, Kuningan, Karet Kuningan, Kota Jakarta Selatan",-6.2138243,106.8237225,41.4
Kwetiau 71,4.6,9,"Jl. Pd. Cabe Raya No.69, RW.5, Pd. Cabe Udik, Kota Tangerang Selatan",-6.3457849999999985,106.7541571,41.4
GoFood,4.6,9,"Jl. Raya Cirendeu No.35, RT.14/RW.3, Cireundeu, Kota Tangerang Selatan",-6.309371400000001,106.77232859999998,41.4
Nasi Goreng Gila Warguh,4.6,9,"Jl. Raya Kby. Lama No.14-24, RT.3/RW.1, Sukabumi Utara, Kota Jakarta Barat",-6.2126633,106.7832967,41.4
Nasi goreng seafood bang kur,5.0,8,"Jl. Pejompongan Raya No.13, RT.1/RW.6, Bend. Hilir, Kota Jakarta Pusat",-6.2032991000000015,106.804446,40.0
Nasi Goreng Rahayu,5.0,8,"Jl. RS. Fatmawati Raya No.24, RT.14/RW.4, Cipete Sel., Kota Jakarta Selatan",-6.2753237,106.7978548,40.0
Nasi goreng bejjo joe,5.0,8,"Samping indomart joe, Jl. Joe Klp. Tiga Depan pusdiklat, RT.5/RW.3, Lenteng Agung, Jakarta",-6.3248016,106.83002920000001,40.0
Nasi Goreng Kambing Solihin,4.0,10,"Jl. Gudang Peluru Raya, RT.3/RW.2, Kb. Baru, Kota Jakarta Selatan",-6.230932599999999,106.8628943,40.0
Nasi Goreng Gila DPR,5.0,8,"Jl. Flamboyan I, RT.3/RW.10, Menteng Dalam, Kota Jakarta Selatan",-6.2308739,106.8405487,40.0
NASI GORENG PETE JPO,4.0,10,"Jalan Raya Kalibata No.Kalibata City Jl. Raya Kalibata No.1, RT.6/RW.7, Rawajati, Pancoran, RT.6/RW.7, Rawajati, Kota Jakarta Selatan",-6.2556294999999995,106.8516373,40.0
Nasigoreng kembar jaya Indomaret taman kedaung,5.0,8,"Jl. Taman Kedaung Raya, Kedaung, Kota Tangerang Selatan",-6.316788900000001,106.7398541,40.0
Nasi Goreng Tegal Indah,4.0,10,"Jl. Wr. Sila I, RT.2/RW.5, Ciganjur, DKI Jakarta",-6.345395,106.81163000000001,40.0
Nasi Goreng Bang Gofur.,4.0,10,"Jl. RC. Veteran Raya No.8-9, RT.1/RW.3, Bintaro, Kota Jakarta Selatan",-6.2741256,106.7635653,40.0
Nasi Goreng Elmira,4.9,8,"cimanggis, Jl. Raya Duta Pelni, Cisalak, Kota Depok",-6.372719,106.859127,39.2
Nasi Goreng Kambing Haji Ismail,4.9,8,"Jl. Komp. Depag, Bambu Apus, Kota Tangerang Selatan",-6.3247520999999995,106.7349506,39.2
Nasi Goreng Pakde Tuko,4.9,8,"Jl. Pangkalan Jati 2 No.23, RW.1, Pangkalan Jati, Kota Depok",-6.3173533,106.79340079999999,39.2
Nasi Goreng Cemplon,4.9,8,"Jl. Praja Dalam K No.59, RT.6/RW.5, Kby. Lama Sel., Kota Jakarta Selatan",-6.251967,106.783422,39.2
Nasi Goreng Bang Doel,4.9,8,"Jl. Buntu Larangan No.11-73, RT.001/RW.009, Larangan Indah, Kota Tangerang",-6.2319428,106.7314505,39.2
NASGOR AE,3.9,10,"Jl. Mampang Prapatan II No.42, RT.9/RW.3, Mampang Prapatan, South Jakarta City",-6.2437527,106.82805630000001,39.0
WARUNG AYAM BAKAR SEDAP MALAM,3.9,10,"Jl. Raya Jagakarsa, RT.1/RW.7, Jagakarsa, Kota Jakarta Selatan",-6.3266615999999996,106.82209070000002,39.0
Nasi Goreng Gila Mas Heri,4.3,9,"Cempaka Putih Jalan Pahlawan Blok, Jl. Cempaka Putih 1 No.22, Rempoa, Kota Tangerang Selatan",-6.2974665000000005,106.7609169,38.699999999999996
nasi goreng brebes,4.3,9,"Jl. Pancoran Buntu 2 No.40, RT.6/RW.2, Pancoran, Kota Jakarta Selatan",-6.247655,106.84486240000001,38.699999999999996
Nasi Goreng Kambing Bang Arifin,4.3,9,"Jl. H. Saidin No.35, Bambu Apus, Kota Tangerang Selatan",-6.327749099999999,106.73535729999999,38.699999999999996
NASI GORENG TIGA SAUDARA,4.8,8,"JL KH. Dewantoro No.17, RT.01/RW.03, Ciputat, Kota Tangerang Selatan",-6.3050073,106.7470865,38.4
Nasi Goreng Gila Lehi,4.8,8,"Blok Bontong No.7, Jl. Raya Jagakarsa No.3, RT.9/RW.7, Jagakarsa, Kota Jakarta Selatan",-6.3277633,106.8241624,38.4
Nasi goreng Mas BEJJO,4.8,8,"Jl. Klp. Hijau, RT.no55. Rt6/RW.3, Jagakarsa, Kota Jakarta Selatan",-6.3268789000000005,106.82799159999999,38.4
Nasi Goreng ACONG,3.8,10,"Jaln Bulak Raya/Abdul Ghani No.31, Cemp. Putih, Kota Tangerang Selatan",-6.3029535,106.7573336,38.0
NASGOR BERKAH MAS MI'IL,4.6,8,"Jl. Lapangan Merah No.10, RW.7, Srengseng Sawah, Kota Jakarta Selatan",-6.3556392,106.82122939999999,36.8
Nasi Goreng Sederhana,4.6,8,"Gang.H.Amat No.1B, RT.1/RW.3, Jagakarsa, Kota Jakarta Selatan",-6.322699,106.831074,36.8
Nasi Goreng G4,4.0,9,"Jl. Persatuan No.1, RT.1/RW.4, Grogol Sel., Kota Jakarta Selatan",-6.226440999999999,106.76977920000002,36.0
nasgor slawi ayu,4.5,8,"Jl. Durian, RT.10/RW.2, Jagakarsa, Kota Jakarta Selatan",-6.3268942,106.81621670000001,36.0
Nasi Goreng Pak De Agus Pete-Ati Ampla,4.5,8,"Jl. Ciputat Raya, RT.3/RW.8, Kby. Lama Utara, Kota Jakarta Selatan",-6.2417099,106.7807348,36.0
Nasi Goreng Spesial Aang Tompel,4.5,8,"Jl. Aria Putra No.86, Kedaung, Kota Tangerang Selatan",-6.3162007000000004,106.742703,36.0
Nasi Goreng Sedap Malam,4.4,8,"Raya, Jl. Kalisari III No.17, RT.3/RW.3, Kalisari, East Jakarta City",-6.3330696999999985,106.852796,35.2
Nasi Goreng Si Geleng,4.4,8,"Jl. Kalisari No.9, RT.2/RW.2, Kalisari, Kota Jakarta Timur",-6.3401304000000005,106.85653329999998,35.2
NASI GORENG KOMPLEK AD,3.9,9,"Jl. H. Hasan No.55, RT.9/RW.2, Baru, Kota Jakarta Timur",-6.3231376,106.8486182,35.1
NASI GORENG TIGA SAUDARA3,3.9,9,"Jl. Rw. Simprug 3, RT.7/RW.8, Grogol Sel., Kota Jakarta Selatan",-6.227599000000001,106.7887955,35.1
Nasi Goreng Slawi Ayu Tenan,5.0,7,"Jl. Batu Kecubung I No.35, RT.2/RW.4, Batu Ampar, Kota Jakarta Timur",-6.2745808,106.85767959999998,35.0
NASI BOX DAN NASI KOTAK,5.0,7,"Jl. Koja 5, Kukusan, Kota Depok",-6.3640294,106.8198865,35.0
Aneka Nasi & Lauk Lintang Ferawati,5.0,7,"Jl. Dasa 1 No.29, RT.7/RW.1, Gandaria Utara, Kota Jakarta Selatan",-6.257155699999998,106.78547590000001,35.0
Nasi Goreng Ortega,5.0,7,"Jl. U No.1, RT.1/RW.11, Palmerah, Kota Jakarta Barat",-6.2021030999999995,106.78507990000001,35.0
Nasi Goreng Mas Joko,5.0,7,"Jl. Raya Cirendeu No.6, Cireundeu, Kota Tangerang Selatan",-6.3120040999999985,106.7702966,35.0
Nasi Goreng Brebes,5.0,7,"Jl. Limun No.31 A, Pisangan, Kota Tangerang Selatan",-6.3083604000000015,106.7566959,35.0
Nasi Goreng Pak De Nasori,5.0,7,"Jl. K.H. Royani I No.25, RT.9/RW.1, Kuningan, Karet Kuningan, Kota Jakarta Selatan",-6.216875900000002,106.82174760000001,35.0
nasi cobek Bang Jams,5.0,7,"Jl. Surya Kencana No.4, Pamulang Bar., Kota Tangerang Selatan",-6.351397400000001,106.73447649999999,35.0
"Nasi Goreng ""Gila"" Pak De Yono",5.0,7,"Jalan Tengah Pondok Kuliner Waduk Setiabudi # Setiabudi, Jl. Setia Budi Barat No.13, RT.2/RW.3, Kuningan, Setia Budi, Kota Jakarta Selatan",-6.2051115999999995,106.82704509999999,35.0
Nasi Goreng Barokah,4.3,8,"Jalan Haji Mukhtar Raya Rt 10 Rw 11, Petukangan Utara, Pesanggrahan, RT.10/RW.11, Petukangan Utara, Kota Jakarta Selatan",-6.2259970000000004,106.742259,34.4
Nasi Goreng Bollywood,4.3,8,"Jl. Kostrad Pusri, RT.1/RW.6, Petukangan Utara, Kota Jakarta Selatan",-6.2311071999999985,106.7573278,34.4
Nasi Goreng Mas Agung,4.3,8,"Jl. Merak No.26, Jurang Manggu Tim., Kota Tangerang Selatan",-6.2668243,106.73460109999999,34.4
Nasi Goreng Damai Raya,4.9,7,"RT.12/RW.2, South Petukangan, South Jakarta City",-6.2463026,106.7518551,34.300000000000004
Nasi Goreng Nagobul (Om Manto),4.9,7,"RT.2/RW.3, Cipedak, South Jakarta City",-6.351465,106.80952590000001,34.300000000000004
Nasi Goreng Mas Iwan Bewok,4.9,7,"Cempaka Putih, South Tangerang City",-6.2981133,106.7482777,34.300000000000004
Nasi Goreng Evan Group,4.9,7,"Jaln Bulak Raya/Abdul Ghani, Cemp. Putih, Kota Tangerang Selatan",-6.2993717,106.7574281,34.300000000000004
Nasi Goreng Wijaya,4.9,7,"Tanah Baru, Depok City",-6.373350599999998,106.80077220000001,34.300000000000004
Nasgor Bawah Pohon Mas Udin,4.9,7,"Jl. Jati Raya Tim. No.1, Pd. Labu, Kota Jakarta Selatan",-6.315794400000001,106.79309070000001,34.300000000000004
Nasi Goreng Camar,3.8,9,"AP, Jl. Bintaro Utama 3 No.76, Pondok Betung, South Tangerang City",-6.271865000000001,106.74781270000001,34.199999999999996
Nasi Goreng Kambing Pak Tohirin,3.8,9,"Jl. Surya Kencana, Pamulang Bar., Kota Tangerang Selatan",-6.3496586,106.73456759999999,34.199999999999996
Nasi Goreng Rapopo,4.7,7,"Jl. Swadaya Raya No.8, RT.002/RW.007, Larangan Indah, Kota Tangerang Selatan",-6.229001999999999,106.73024299999999,32.9
Nasi Goreng Teri Medan Pak Slamet,4.7,7,"Jl. Cipaku I No.2, RT.12/RW.4, Petogogan, Kota Jakarta Selatan",-6.2396394,106.81087169999999,32.9
nasi Goreng Sea Food Mas Gio 57,4.7,7,"Ciputat, South Tangerang City",-6.324607599999998,106.74652990000001,32.9
NASI GORENG GIRI HANDAYANI (pakdhe wagino),4.7,7,"Jl. Moh. Kahfi 1 Blok Damong No.17, RT.7/RW.3, Cipedak, Kota Jakarta Selatan",-6.3633937000000005,106.8046825,32.9
nasi goreng . jl.cikajang,4.7,7,"Jl. Cikajang No.3, RT.1/RW.6, Petogogan, South Jakarta City",-6.240524099999999,106.81056629999999,32.9
Nasi Goreng Dan Martabak Bang Udin,4.7,7,"Jl. Raya Lenteng Agung No.4, RT.9/RW.2, Srengseng Sawah, Kota Jakarta Selatan",-6.346794,106.83356100000002,32.9
Nasi Goreng KPJ,4.7,7,"Jl. Kubis IV, RT.005/RW.005, Pd. Cabe Ilir, Kota Tangerang Selatan",-6.337121,106.76990500000001,32.9
Warung Bu Roso Asli Purwokero,4.1,8,"Jl. Kerinci XI No.29, RT.5/RW.2, Gunung, Kota Jakarta Selatan",-6.239621400000001,106.78847079999998,32.8
Nasi Goreng Mas Andi,4.1,8,"Jl. SD Bojong No.7-27, RT.1/RW.12, Grogol Sel., Kota Jakarta Selatan",-6.2302230000000005,106.76775249999999,32.8
Nasi Goreng Cak Oleng,4.1,8,"No., Jl. Gotong Royong No.14, RT.6/RW.9, Cijantung, Kota Jakarta Timur",-6.3253135999999985,106.8536509,32.8
NASGOR DPR,4.6,7,"Gg. Porenta I, Pd. Betung, Kota Tangerang Selatan",-6.2620787999999985,106.75530309999999,32.199999999999996
Nasi Goreng Bang Ucrit,4.6,7,"RT.4/RW.14, Cililitan, East Jakarta City",-6.259049299999999,106.86874509999998,32.199999999999996
Nasi Goreng Arman,4.6,7,"c, Jl. H. A. Mutholib No.20, Tugu, Kota Depok",-6.3640351,106.8516507,32.199999999999996
Nasi Goreng Pendawa Lima Pa'De Kumis,4.0,8,"Jl. Pd. Labu Raya No.75, RT.5/RW.1, Pd. Labu, Kota Jakarta Selatan",-6.314719699999999,106.79356609999998,32.0
Nasi Goreng Comal Pak Muji ManggalaWanabakti,4.0,8,"1, RT.1/RW.3, Gelora, Kota Jakarta Pusat",-6.2066287,106.79828140000001,32.0
ORTEGA Fried Rice Restaurant,4.4,7,"Jl. Karang Tengah Raya No.11-13, RT.6/RW.4, Lb. Bulus, Kota Jakarta Selatan",-6.30354,106.7814449,30.800000000000004
Pisang Goreng Tanduk Ellicita,4.4,7,"Jl. Tebet Barat Dalam X No.E No. 20, RT.12/RW.5, Tebet Bar., Kota Jakarta Selatan",-6.24189,106.84854890000001,30.800000000000004
Warung Nasi Ismi,4.4,7,"Jalan RS Fatmawati, RT.1/RW.2, Gandaria Selatan, Cilandak, RT.1/RW.2, Gandaria Sel., Kota Jakarta Selatan",-6.2641538,106.79710349999999,30.800000000000004
Nasi Goreng Gila Camel,4.4,7,"Jalan Jatinegara Barat No.166A 2 1, RT.2/RW.1, Kp. Melayu, Kota Jakarta Timur",-6.2250922,106.86649299999999,30.800000000000004
Nasi Goreng Indofood Kalisari,4.4,7,"Unnamed Road, RT.13/RW.9, Kalisari, Kota Jakarta Timur",-6.332621800000001,106.85893689999999,30.800000000000004
Nasi Goreng Tasbih,3.8,8,"Jl. Muara No.21, RT.2/RW.3, Tj. Bar., Kota Jakarta Selatan",-6.3094893,106.85557890000001,30.4
Nasi Goreng Pangkalan 2,4.3,7,"Jl. Nimun Raya No.28, RT.2/RW.10, Kby. Lama Sel., Kota Jakarta Selatan",-6.257410299999999,106.7738029,30.099999999999998
Warung Nasi Goreng NGKS,4.3,7,"Jalan Menteng atas selatan 3, RT 02 No 5, RT.4/RW.5, Menteng Atas, Kota Jakarta Selatan",-6.2213379999999985,106.84326999999999,30.099999999999998
Nasi Goreng Bumen Jaya,4.3,7,"Jl. D. Tondano No.14, RT.21/RW.4, Bend. Hilir, Kota Jakarta Pusat",-6.2078782,106.806141,30.099999999999998
Rm.Nasi Goreng(Moga Barokah),4.3,7,"Jl. Gongseng Raya No.6-56, RT.7/RW.10, Cijantung, Kota Jakarta Timur",-6.3257739,106.86051440000001,30.099999999999998
Nasi Goreng Ridho,5.0,6,"Jl. Oscar Raya, Bambu Apus, Kota Tangerang Selatan",-6.328612000000001,106.7310562,30.0
Nasi Goreng Warung Family,5.0,6,"Jl. Pahlawan No.27, RW.13, Rempoa, Kota Tangerang Selatan",-6.286554,106.76027990000001,30.0
Nasi Goreng D'Saudah,5.0,6,"Jl. Rw. Belong, RT.9/RW.15, Palmerah, Kota Jakarta Barat",-6.2014415000000005,106.78265590000001,30.0
NASI GORENG YAHUUUD,5.0,6,"Jl. Pisangan Baru Tengah No.298, RT.5/RW.11, Pisangan Baru, Kota Jakarta Timur",-6.211443,106.86806000000001,30.0
Nasi Goreng Dan Pecel Lele Bang Sarta,5.0,6,"Jl. Masjid Nur No.8-75, RT.12/RW.10, Grogol Utara, Kota Jakarta Selatan",-6.2198971,106.7850156,30.0
Depot Nasi Goreng Nurhayati,5.0,6,"Jl. Ciledug Raya No.20-33, RT.2/RW.3, Petukangan Utara, Kota Jakarta Selatan",-6.2365328999999985,106.75329209999998,30.0
nasi goreng lindra,5.0,6,"RT.1/RW.1, Ragunan, South Jakarta City",-6.292212399999999,106.8216051,30.0
NASGOR Mas Pendek,3.6,8,"RT.5/RW.8, Lebak Bulus, South Jakarta City",-6.309310399999998,106.78652009999999,28.8
Nasi Goreng Bang Kumis / RT Ub,4.8,6,"Jl. W R Supratman No.43, Rengas, Kota Tangerang Selatan",-6.2810017,106.7464637,28.799999999999997
Nasi Goreng cak Abas,4.8,6,"1, RT.1/RW.3, Gelora, Kota Jakarta Pusat",-6.2148940999999995,106.8007315,28.799999999999997
Nasi Goreng Boga Rasa,4.8,6,"RT.2/RW.4, Lebak Bulus, South Jakarta City",-6.302279299999999,106.77757220000001,28.799999999999997
NASI GORENG GILA BUMIJAWA,4.8,6,"Jl. Warung Buncit Raya No.25, RT.5/RW.3, Kalibata, Kota Jakarta Selatan",-6.2626181,106.8304767,28.799999999999997
Nasi goreng mas roni,4.8,6,"Jl. Masjid Baiturrahim, Jurang Manggu Tim., Kota Tangerang Selatan",-6.2628439999999985,106.7390794,28.799999999999997
Nasi Goreng,4.8,6,"Jl. Kav. Keuangan Raya No.60, RT.1/RW.1, Kedaung, Kota Tangerang Selatan",-6.3094788,106.73411909999999,28.799999999999997
Nasi Goreng Waluyo,4.8,6,"Jl. Maribaya Blok G2 No.1, Pangkalan Jati, Kota Depok",-6.3220023,106.78291840000001,28.799999999999997
Sahila Nasi Goreng & Tempe Mendoan,4.8,6,"Jl. Raya Lapan, RT.6/RW.1, Pekayon, Kota Jakarta Timur",-6.340945400000001,106.8636996,28.799999999999997
Nasi Goreng Spesial Mix,4.8,6,"Jl. Tarumanegara No.17B, Pisangan, Kota Tangerang Selatan",-6.3137517,106.7553183,28.799999999999997
NASGOR MAS AGUS,4.8,6,"Jl. Kalibata Timur I No.20, RT.9/RW.1, Kalibata, Kota Jakarta Selatan",-6.2593062999999995,106.84781720000001,28.799999999999997
Nasi Goreng Bang Holen,4.1,7,"Jalan H. Juhri, RT.1/RW.8, Meruya Sel., Kota Jakarta Barat",-6.210791099999999,106.7356263,28.699999999999996
Nasi Goreng Tip Top,4.1,7,"23-, Jl. U No.27, RT.9/RW.15, Palmerah, Kota Jakarta Barat",-6.202392,106.78422900000001,28.699999999999996
NASI GORENG JAYA 99,4.1,7,"Jl. Curug Agung No.50a, RT.1, Tanah Baru, Kota Depok",-6.36802,106.805596,28.699999999999996
WM. NASGOR PONDOK SELERA,4.1,7,"Jl. Warga No.3, RT.17/RW.3, Pejaten Bar., Kota Jakarta Selatan",-6.272532900000001,106.8391295,28.699999999999996
Nasi Goreng Cak Alan Khas Surabaya,4.1,7,"Jl. Komjen.Pol.M.Jasin No.129, Tugu, Kota Depok",-6.355453900000001,106.8529963,28.699999999999996
Nasgor dok dok,4.7,6,"RT.5/RW.4, Jagakarsa, South Jakarta City",-6.3170254,106.8161362,28.200000000000003
Nasi Goreng Mas Nur,4.7,6,"Jl. Cabe IV No.20, Pd. Cabe Udik, Kota Tangerang Selatan",-6.3323038,106.76884609999999,28.200000000000003
Nasi Goreng Ojolali,4.7,6,"Jl. Taman Alfa Indah, RT.7/RW.3, Joglo, Kota Jakarta Barat",-6.220553100000001,106.7548642,28.200000000000003
Nasi Goreng Botor Botorr,4.7,6,"Jl. Sirsak, RT.2/RW.4, Ciganjur, Kota Jakarta Selatan",-6.337595599999998,106.81820390000001,28.200000000000003
Nasi Goreng Bu Sum,4.7,6,"Jl. Sidik No.19-30, RT.4/RW.6, Kuningan, Karet Kuningan, Kota Jakarta Selatan",-6.2196593999999985,106.8230054,28.200000000000003
nasi goreng puri sakti (1)zaenal,4.7,6,"Jl. Puri Sakti I, RT.1/RW.2, Cipete Sel., Kota Jakarta Selatan",-6.272753199999999,106.8098217,28.200000000000003
Nasi Goreng Sakur,4.7,6,"Jl. Ee, RT.6, Sukabumi Utara, Kota Jakarta Barat",-6.2123095,106.77866259999999,28.200000000000003
Nasi Goreng Jamal,4.0,7,"Jl. Camat Gabun No.1, RT.4/RW.8, Lenteng Agung, Kota Jakarta Selatan",-6.3377015,106.83690209999999,28.0
Kantin MPR DPR,4.0,7,"RT.1/RW.3, Gelora, Central Jakarta City",-6.207667099999999,106.79887959999999,28.0
Nasi Goreng Gila Ponja,3.9,7,"Jl. Pondok Jaya II, RT.2/RW.6, Pela Mampang, Kota Jakarta Selatan",-6.247405499999998,106.82368459999999,27.3
Nasi Goreng Kambing Mas Arif,4.5,6,"Jl. Muria Tanjakan No.76, RT.12/RW.2, Menteng Atas, Kota Jakarta Selatan",-6.2127606,106.83799170000002,27.0
Nasgor Gila 99,4.5,6,"Jl. H. Muchtar Raya No.56, Petukangan Utara, Kota Jakarta Selatan",-6.2336485,106.7448932,27.0
Warung Nasi Sari Rasa 2,4.5,6,"JL Khair No 61 Ragunan RT 02, RT.2/RW.4, Ragunan, Kota Jakarta Selatan",-6.3042903,106.82046799999999,27.0
Nasi Goreng Gondrong Wonge Dewek,4.5,6,"Jalan Ciledug Raya no.8 11 2, RT.11/RW.2, Cipulir, Kota Jakarta Selatan",-6.2372584999999985,106.77566440000001,27.0
NASI GORENG 46,4.5,6,"RT 002 RW 001 Komplek Pertamina, Jl. Yaktapena Raya, Pd. Ranji, Kota Tangerang Selatan",-6.2863989999999985,106.74520700000001,27.0
Saputra Nasi Goreng,4.3,6,"Jalan Karya Utama Rt 03 Rw 06 Nomor 70, Srengseng, Kembangan, RT.3/RW.6, Srengseng, Kota Jakarta Barat",-6.2127021,106.7612585,25.799999999999997
Nasi Goreng Si Coy,4.3,6,"Jl. Madrasah No.6, RT.9/RW.9, Kb. Jeruk, Kota Jakarta Barat",-6.2016694,106.7773005,25.799999999999997
Nasi Goreng Gila Mas Idin,4.3,6,"No., Jl. Raya Kby. Lama No.15, RT.4/RW.3, Grogol Utara, Kota Jakarta Selatan",-6.208142,106.7834244,25.799999999999997
NASGOR TETENG ( ati Ampela ),4.3,6,"Jl. Klp. Dua Raya, Tugu, Kota Depok",-6.3687594,106.8426274,25.799999999999997
Nasi Goreng Sedap Malam - Rawa Kopi,4.3,6,"Jl. Pangkalan Jati No.8, Pangkalan Jati, Kota Jakarta Selatan",-6.325305999999999,106.7953649,25.799999999999997
RASAIN!,4.3,6,"Jalan raya Lenteng agung no. 36, Kp. Sawah No.27 RT 01/01, RT.1/RW.1, Srengseng Sawah, Kota Jakarta Selatan",-6.3541335,106.8323041,25.799999999999997
ADI BAROKAH,4.2,6,"Jl. Ir H. Juanda Jl. Semanggi II, Cemp. Putih, Kota Tangerang Selatan",-6.3098801999999985,106.75533109999999,25.200000000000003
Nasi Goreng SM Senja Malam,4.2,6,"Jl. Lebak Bulus Raya No.41. A, RT.9/RW.7, Pd. Pinang, Kota Jakarta Selatan",-6.2890348,106.77304740000001,25.200000000000003
Warung Nasi Mas Ari,5.0,5,"Jl. Mesjid Al Huda, RT.1/RW.3, Kby. Lama Utara, Kota Jakarta Selatan",-6.240574,106.781347,25.0
Nasi goreng gila mas acil,5.0,5,"Jl. Denpasar Raya No.6, RT.6/RW.7, Kuningan, Karet Kuningan, Kota Jakarta Selatan",-6.217671599999999,106.8298051,25.0
Nasi Goreng BENTUMAN,5.0,5,"no 15, Jl. Kalibata Utara II No.RT 12, RT.11/RW.7, Kalibata, Kota Jakarta Selatan",-6.261054,106.8314731,25.0
Nasi Goreng Gila,5.0,5,"Jl. Tebet Tim. Dalam XI No.103, RT.3/RW.6, Tebet Tim., Kota Jakarta Selatan",-6.236461599999999,106.8570007,25.0
Nasi Goreng Barokah,5.0,5,"Jl. Tanah Baru No.15, RT.3/RW.5, Tanah Baru, Kota Depok",-6.37127,106.8085492,25.0
Nasi Goreng Bu Agus,5.0,5,"Kukusan, Depok City",-6.3624147,106.81966000000001,25.0
Nasi goreng warjuki,5.0,5,"Jl. Bintaro Permai IV No.29, RT.8/RW.9, Bintaro, Kota Jakarta Selatan",-6.2626351,106.76038770000001,25.0
Nasi Goreng Java Food Batam 01,5.0,5,"Jl. Batu Ampar 1, RT.1/RW.6, Batu Ampar, Kota Jakarta Timur",-6.2725387999999995,106.8631396,25.0
Nasi Goreng @Mas'al,5.0,5,"Jl. Mampang Prapatan VIII No.1, RT.2/RW.1, Tegal Parang, Kota Jakarta Selatan",-6.2478224,106.83181409999999,25.0
Nasi Goreng Gila Jaya,5.0,5,"Jl. H. Muchtar Raya No.64, RT.12/RW.11, Petukangan Utara, Kota Jakarta Selatan",-6.2260805,106.74368009999999,25.0
Nasi Goreng 2001 Citra Rasa 01,5.0,5,"Jl. Moh. Kahfi 1, RT.5/RW.1, Ciganjur, Kota Jakarta Selatan",-6.330083599999999,106.8086966,25.0
Nasi Goreng Si Doel,5.0,5,"Jl. Cikoko Brt. Dalam I No.RT03/03, RT.3/RW.3, Cikoko, Kota Jakarta Selatan",-6.2442986,106.85104820000001,25.0
Nasi Goreng Ngadio,5.0,5,"Jl. Bangka II Gg. I No.14, RT.5/RW.1, Pela Mampang, Kota Jakarta Selatan",-6.2450928,106.8185385,25.0
Nasi Goreng Cabang Maman Hek,4.8,5,"Jl. H. Taiman Ujung, RT.1/RW.10, Gedong, Kota Jakarta Timur",-6.2985185999999995,106.865225,24.0
Nasi Goreng Enak Gillaaa.. /GEG,4.0,6,"No., Jl. H. Hasan No.2, RT.2/RW.9, Baru, Kota Jakarta Timur",-6.324138099999999,106.85053629999999,24.0
NASI GORENG MAS NDUT / KUMIS,4.8,5,"Jl. Pinang Kalijati No.37-48, RT.7/RW.9, Pd. Labu, Kota Jakarta Selatan",-6.3059407,106.80106620000001,24.0
Nasi Goreng Goban,4.8,5,"Jl. Surya Kencana No.73-74, Pamulang Bar., Kota Tangerang Selatan",-6.348047999999999,106.734824,24.0
nasi goreng 87 chinese food,4.8,5,"Jl. Limo Raya No.124, Limo, Kota Depok",-6.363980000000001,106.7760689,24.0
Warung Nasi Pendowo,4.8,5,"Jl. Pendowo, Limo, Kota Depok",-6.366577200000001,106.78273940000001,24.0
Nasi Goreng Bedeng 79,4.8,5,"Unnamed Road, Ciputat, Kota Tangerang Selatan",-6.325758,106.7434588,24.0
Nasi Goreng & Uduk Sultan,4.0,6,"Jl. Rumbut No.59, Pasir Gn. Sel., Kota Depok",-6.345620299999998,106.85215900000001,24.0
NASI GORENG ENAK,4.8,5,"Gg. Musyawarah, RT.8/RW.9, Jati Padang, Kota Jakarta Selatan",-6.289306400000001,106.82918319999999,24.0
Nasi Goreng 99,4.8,5,"RT.2/RW.3, Cijantung, East Jakarta City",-6.319612299999998,106.85826019999999,24.0
Warkop EMA LIMIH,3.3,7,"Jl. Rawakalong No.21, Grogol, Kota Depok",-6.3733512,106.7957227,23.099999999999998
Nasi Goreng Pesanggrahan,4.6,5,"Gg. Subur, RT.009 Rw001/RW.1, no:62, Kota Jakarta Selatan",-6.254678699999999,106.76431229999999,23.0
Nasi Goreng Bang Emen,4.6,5,"Jl. Lenteng Agung Raya No.24 13 7, RT.13/RW.7, Lenteng Agung, Kota Jakarta Selatan",-6.331675700000001,106.83540020000001,23.0
Pisang Goreng Arjuna Antasari,4.6,5,"Jl. Pangeran Antasari No.18, RT.5/RW.13, Cilandak Bar., Kota Jakarta Selatan",-6.2835363,106.8071028,23.0
Nasi Goreng Gaul,4.6,5,"Jl Nangka No: 20, RT.6/RW.5, Tj. Bar., Kota Jakarta Selatan",-6.3025426,106.8492743,23.0
Nasi Goreng Babat,4.6,5,"Jalan Pintu Senayan 1 Floor 5 Fx Sudirman Gelora Tanah Abang, Jakarta Pusat, RT.1/RW.3, Gelora, Kota Jakarta Pusat",-6.224387000000001,106.80399399999999,23.0
Nasi Goreng Cak Doel,4.6,5,"Jl. Ps. Minggu Raya No.44, RT.8/RW.9, Pancoran, Kota Jakarta Selatan",-6.2518384000000005,106.84279,23.0
Biang Nasgor Toro1,4.6,5,"Depan Ruko Bona Jalan Karang Tengah Raya Nomor 3G Lebak Bulus, RT.5, Lb. Bulus, DKI Jakarta",-6.300951,106.78013899999999,23.0
NASI GULE (PKL),3.7,6,"Jl. Raya Kby. Lama No.188, RT.1/RW.3, Cipulir, Kota Jakarta Selatan",-6.2345942,106.7802308,22.200000000000003
Nasi Goreng Enakk Banget,3.7,6,"Jl. Dr. Saharjo No.55, RT.16/RW.8, Manggarai, Kota Jakarta Selatan",-6.2135634999999985,106.8450632,22.200000000000003
Nasi Goreng Komeng,4.4,5,"Pujasera Nyi Ageng Serang, Jl. H. Achmad Bakrie Bar., RT.2/RW.5, Karet Kuningan, Kota Jakarta Selatan",-6.2229839999999985,106.8350315,22.0
Nasi Goreng Husin,4.4,5,"Jl. Qrisdoren No.1, RT.8/RW.5, Sukabumi Utara, Kota Jakarta Barat",-6.209911399999998,106.77409409999999,22.0
Nasi Goreng Mas Tejo,4.4,5,"Jl. H. Jeni I No.1A, RT.8/RW.7, Gandaria Utara, Kota Jakarta Selatan",-6.263547900000001,106.79463829999999,22.0
