Name,Rating,NumberOfUser,Address,lat,lon,X
Kedai bang jothi,3.7,3,"Jln. Cilandak dalam 1/33 rt 06/013 jkt 12430, Jl. Cilandak Dalam No.33, RT.4/RW.13, Cilandak Bar., Kota Jakarta Selatan",-6.285035,106.8034159,11.100000000000001
Nasi Goreng Tegal Bahari Stasiun Tebet,3.7,3,"Jl. Asem Baris, RT.1/RW.5, Kb. Baru, Kota Jakarta Selatan",-6.22584,106.85908500000001,11.100000000000001
"Nasi Goreng ""Ceria""",3.7,3,"Jl. Lkr. Sari No.6-13, RT.6/RW.9, Pekayon, Kota Jakarta Timur",-6.333243,106.8623792,11.100000000000001
NASI GORENG PONDOK SELERA 09,3.7,3,"Jl. H. Asmawi No.5c, Beji, Kota Depok",-6.3745756999999985,106.81321909999998,11.100000000000001
Nasi Goreng Pak Kasan,5.0,2,"TPU, Jl. Tanah Baru No.50 RT.4/RW.7 (Samping, Tanah Baru, Kota Depok",-6.3659944,106.80754850000001,10.0
Nasi goreng be'eng,5.0,2,"Sawah Lama, South Tangerang City",-6.300827300000001,106.74028270000001,10.0
Nasi Goreng Katon,5.0,2,"Jl. Ki Hajar Dewantara No.45 H, Sawah Lama, Kota Tangerang Selatan",-6.2997488,106.73994990000001,10.0
Nasi Goreng Ibu Ayu Lamongan,5.0,2,"Jalan Penghulu #29 Rt1 Rw1, Jakarta Selatan, RT.12/RW.1, Cipulir, Kota Jakarta Selatan",-6.240289,106.779307,10.0
Nasi goreng Bang Udin,5.0,2,"Jl. H. A. Mutholib, Tugu, Kota Depok",-6.364954200000001,106.85143889999999,10.0
Nasi Goreng Bang Ridu,5.0,2,"Jl. Raya Gandul, Gandul, Kota Depok",-6.3370266,106.7948611,10.0
BURUNG GORENG,5.0,2,"Krukut, Depok City",-6.3624537000000005,106.7913402,10.0
Nasi Goreng Gondrong Morlaok,5.0,2,"RT.13/RW.2, Gunung, South Jakarta City",-6.2386577,106.7901678,10.0
Nasi Goreng Mba Ekti,5.0,2,"Jl. Poncol 9 No.9, RT.14/RW.5, Kuningan Bar., Kota Jakarta Selatan",-6.2371311999999985,106.81960670000001,10.0
nasi goreng surabaya cak husen,5.0,2,"Jaln Bulak Raya/Abdul Ghani, Cemp. Putih, Kota Tangerang Selatan",-6.3018208,106.7584499,10.0
Tenda Arema,5.0,2,"Jl. Gelora No.1, RT.1/RW.3, Senayan, Kota Jakarta Pusat",-6.2126547,106.79718270000001,10.0
Nasi goreng bang ALI,5.0,2,"Jl. Komp. Peternakan No.35, Tanah Baru, Kota Depok",-6.3635613,106.80355630000001,10.0
Nasi Goreng Pas Mantap,5.0,2,"Jl. K.H.M. Usman No.86, Kukusan, Kota Depok",-6.364930999999999,106.8152765,10.0
Nasi Goreng Mas Amat,5.0,2,"Jl. Panti Asuhan No.37, Jurang Manggu Tim., Kota Tangerang Selatan",-6.257664,106.7304291,10.0
Nasi Goreng Bang Jek,5.0,2,"Jl. Raya Condet No.12, RT.9/RW.5, Batu Ampar, Kota Jakarta Timur",-6.2650003,106.8616597,10.0
Nasi Goreng Lintang Malam,5.0,2,"Jl. Pinding No.3A, RT.1/RW.1, Cipedak, Kota Jakarta Selatan",-6.345307,106.803349,10.0
Nasi Goreng Gile Garsel,5.0,2,"Jl. RS. Fatmawati Raya No.4h, RT.3/RW.5, Cilandak Bar., Kota Jakarta Selatan",-6.289362000000001,106.7952388,10.0
Nasi Goreng Joni,5.0,2,"Jl. Kebagusan Raya No.17, RT.5/RW.7, Ragunan, Kota Jakarta Selatan",-6.297029999999999,106.8266985,10.0
NASI GORENG ANGKA 8,5.0,2,"Jl. Abdul Wahab No.21-10, Kedaung, Kota Depok",-6.3654522999999985,106.74914509999999,10.0
"Nasi Goreng ""DS""",5.0,2,"RT.3/RW.7, Kebon Baru, South Jakarta City",-6.234200200000001,106.8600122,10.0
Nasi Goreng Bang Ipul,5.0,2,"Jl. Prof. DR. Soepomo, RT.1/RW.3, Menteng Dalam, Kota Jakarta Selatan",-6.2326121,106.8444523,10.0
Nasi Goreng Panjul,5.0,2,"Jl. Raya Kompas No.1a, Pd. Ranji, Kota Tangerang Selatan",-6.291669000000001,106.7436862,10.0
Nasi Goreng Sugih Rasa,5.0,2,"Rempoa, South Tangerang City",-6.2927196,106.75227350000002,10.0
TaBo Hainan FriedRice,5.0,2,"Jl. Jatipadang 1A, RT.3/RW.5, Jati Padang, Kota Jakarta Selatan",-6.286180799999999,106.8291222,10.0
Rasaria resto(nasi goreng&mie goreng),5.0,2,"Omah Jajan, Jl. Kapten Tendean No.12c, RT.2/RW.2, Mampang Prpt., Kota Jakarta Selatan",-6.2403865,106.82919240000001,10.0
Nasi goreng amor 99,5.0,2,"Jl. Joe Klp. Tiga No.38, RT.2/RW.3, Lenteng Agung, Kota Jakarta Selatan",-6.3245236999999985,106.8303851,10.0
Nasi Goreng dan Seafood Aladin,5.0,2,"Lapangan Blok.S, Jl. Birah Raya, RT.5/RW.6, Rw. Bar., DKI Jakarta",-6.2364628999999985,106.81523500000002,10.0
Nasi Goreng Ortega,5.0,2,"Jl. Aup No.2-4, RT.4/RW.10, Ps. Minggu, Kota Jakarta Selatan",-6.290826999999998,106.83648980000001,10.0
"Nasi Goreng ""Kota Bahari""",5.0,2,"Jl. Kejaksaan Raya, RT.002/RW.006, Kreo, Kota Tangerang",-6.2277567000000005,106.7377248,10.0
Nasi Goreng Jaya Terus,5.0,2,"No Pasar Rebo, Jl. Gongseng Raya No.6, RT.6/RW.9, Cijantung, East Jakarta City",-6.326467299999999,106.8553773,10.0
NASI GORENG pade Dikin,5.0,2,"Jl. Aren II No.40, RW.1, Pd. Betung, Kota Tangerang Selatan",-6.254150800000001,106.74956090000002,10.0
Nasi Goreng Agus,5.0,2,"Jl. Camat Gabun I, RT.8/RW.8, Lenteng Agung, Kota Jakarta Selatan",-6.3397377,106.83821979999999,10.0
NASI GORENG RIVALDI BAHARI,5.0,2,"alfa midi, Jl. Dr. Setiabudi, gaplek, Kota Tangerang Selatan",-6.3472621,106.74719309999999,10.0
Pedagang Nasi Goreng Kumis,5.0,2,"JL M Kahfi II Gg. Cupang, RT.3/RW.1, Cipedak, Kota Jakarta Selatan",-6.347491000000001,106.802194,10.0
Soto & Nasi Goreng Padang,5.0,2,"Unnamed Road, Pamulang Bar., Kota Tangerang Selatan",-6.3485315,106.7347179,10.0
Nasi Goreng Sedap Malam,5.0,2,"Jalan Raya Condet No 48 Samping Jalan Bantu Ampar 2, RT.3/RW.4, Batu Ampar, DKI Jakarta",-6.274877,106.85656999999999,10.0
Kuliner icha,5.0,2,"Jl. Ibrahim No.14-36, RT.4/RW.5, Sukabumi Utara, Kota Jakarta Barat",-6.208031999999998,106.77615420000001,10.0
Nasi Goreng Teri Kacang,5.0,2,"Jl. Prapanca Raya No.100, RT.9/RW.4, Cipete Utara, Kota Jakarta Selatan",-6.2564138,106.80343799999999,10.0
Nasi Goreng Areng Cuy,5.0,2,"Jl. Raya Cirendeu No.38, RT.5/RW.5, Pisangan, Kota Tangerang Selatan",-6.3230727,106.76820359999998,10.0
Nasi Goreng Sedap Rasa,5.0,2,"Jl. Ir H. Juanda No.75, Cireundeu, Kota Tangerang Selatan",-6.305149200000002,106.75815220000001,10.0
Nasi Goreng Wonogiri Pak Nanang,5.0,2,"Komplek UIN, Jl. Ibnu Batutah, RW.06, Pisangan, Kota Tangerang Selatan",-6.310521,106.75606100000002,10.0
Nasgor 89 Madura,5.0,2,"1 3, RT.1/RW.3, Mampang Prpt., Kota Jakarta Selatan",-6.241039700000001,106.82588829999999,10.0
NASI GORENG BAPERR BABANG EZA,5.0,2,"# Jagakarsa, Jl. Moh. Kahfi 1 No.75, RT.1/RW.2, Jagakarsa, Kota Jakarta Selatan",-6.327001,106.811035,10.0
Ketoprak Sedap Malam,5.0,2,"Sawah Lama, South Tangerang City",-6.2957296,106.73636370000001,10.0
Nasi Goreng Ex Depan BRI Ciputat,5.0,2,"Ruko Ciputat, Jl. Ir H. Juanda, Cipayung, Kota Tangerang Selatan",-6.3120227999999985,106.7489419,10.0
Brizffood,5.0,2,"Jl. Asem II No.20 RT04/03, RT.1/RW.3, Cipete Sel., Kota Jakarta Selatan",-6.2726511999999985,106.80218810000001,10.0
Nasi Goreng Anjani,5.0,2,"Jl. Waru I, RT.2/RW.3, Pamulang Bar., Kota Tangerang Selatan",-6.3428406,106.7376642,10.0
Nasi Goreng BMJ Bang Kumis,5.0,2,"Tanah Baru, Depok City",-6.368306400000001,106.7985058,10.0
Nasi Goreng Mas Imam,5.0,2,"Jl. Aria Putra No.51, Serua Indah, Kota Tangerang Selatan",-6.313070099999999,106.7306006,10.0
Nasi Goreng Gila IKPN,5.0,2,"Jl. RC. Veteran Raya, RT.4/RW.10, Bintaro, Kota Jakarta Selatan",-6.2602248,106.76780349999999,10.0
Sedap Malam,5.0,2,"Jl. Pertengahan, RT.1/RW.7, Cijantung, Kota Jakarta Timur",-6.3184936999999985,106.858616,10.0
Nasi goreng mas decon,5.0,2,"Jl. Sandang, RT.1/RW.11, Palmerah, Kota Jakarta Barat",-6.2017939,106.7877267,10.0
NASI KEBULI GORENG BABA,5.0,2,"RT.3/RW.11, North Grogol, South Jakarta City",-6.2101582,106.78774299999999,10.0
Nasi Goreng Bang Adit,5.0,2,"Jl. Raya Parung - Ciputat, Kedaung, Kota Depok",-6.3679,106.7457112,10.0
Pojok Nasi Goreng,5.0,2,"Jl. Telaga, RT.13/RW.9, Pekayon, Kota Jakarta Timur",-6.3474406,106.8587692,10.0
Nasi Goreng Putra Bumiayu,5.0,2,"Jl. Tanah Kusir, RT.10/RW.11, Kby. Lama Sel., Kota Jakarta Selatan",-6.2606395,106.78497759999999,10.0
Nasi Goreng Special Barito Bu Fatimah,5.0,2,"Jl. Gandaria Tengah III No.3, RT.3/RW.4, Kramat Pela, Kota Jakarta Selatan",-6.246477899999999,106.7930006,10.0
Nasi Goreng Specials,5.0,2,"Jl. Moh. Kahfi 1, RT.3/RW.4, Jagakarsa, Kota Jakarta Selatan",-6.318715900000001,106.8108888,10.0
Nasi Goreng Kampung Bang Oji,5.0,2,"Grogol, Depok City",-6.371433499999998,106.79061440000001,10.0
Nasi Goreng Babat,5.0,2,"Jl. Sultan Iskandar Muda, RT.10/RW.6, Kby. Lama Utara, Kota Jakarta Selatan",-6.245442799999998,106.78238629999998,10.0
NASI GORENG BANG JOY,5.0,2,"Jl. Talas Ⅴ No.47, Pd. Cabe Ilir, Kota Tangerang Selatan",-6.338579200000002,106.75767900000001,10.0
nasi goreng joss khas Pemalang,5.0,2,"Jl. Bambu II No.14, RT.2/RW.6, Srengseng, Kota Jakarta Barat",-6.2106059999999985,106.76042,10.0
Nasi goreng PPC,5.0,2,"Jl. Prapanca Raya, RT.9/RW.4, Cipete Utara, Kota Jakarta Selatan",-6.2562368,106.80327040000002,10.0
NASI GORENG BANG UDIN,5.0,2,"Jl. Sawo No.9B, RT.6/RW.10, Ragunan, Kota Jakarta Selatan",-6.2805805999999995,106.8216733,10.0
Nasi Goreng,5.0,2,"Jl. Swadharma Utara, RT.7/RW.8, Ulujami, Kota Jakarta Selatan",-6.229061799999998,106.76054440000001,10.0
Nasi Goreng Koramil,5.0,2,"Jl. Caringin Utara I No.15, RT.15/RW.10, Cilandak Bar., Kota Jakarta Selatan",-6.283116400000001,106.7928936,10.0
Nasi Goreng Putra Bawang,5.0,2,"RT.13/RW.6, Bintaro, South Jakarta City",-6.2650206,106.7572436,10.0
NASI GORENG GITA IZZAKUIKI,5.0,2,"Jl. Praja Dalam K No.27, RT.11/RW.2, Kby. Lama Sel., Kota Jakarta Selatan",-6.251586,106.78339299999999,10.0
Nasi Goreng Kambing Kebuli,5.0,2,"Jl. Pedurenan Masjid 2, RT.6/RW.4, Kuningan, Karet Kuningan, Kota Jakarta Selatan",-6.2224163,106.82843179999999,10.0
Nasi goreng mas Roni,5.0,2,"Jl. Kostrad Raya No.43, RT.7/RW.4, Petukangan Utara, Kota Jakarta Selatan",-6.2348779,106.75697009999999,10.0
Nasi Goreng Spesial,5.0,2,"Jl. Aria Putra, Serua, Kota Tangerang Selatan",-6.3176501,106.7372551,10.0
NASI GORENG OM TONO,5.0,2,"Jl. Muara Dalam 1 No.84, RT.5/RW.3, Tj. Bar., Kota Jakarta Selatan",-6.3057260999999984,106.8552377,10.0
Nasi Goreng 76,5.0,2,"Jl. RS. Fatmawati Raya No.9, RT.4/RW.6, Gandaria Utara, Kota Jakarta Selatan",-6.259892199999999,106.79657390000001,10.0
Nasi goreng daging sapi,5.0,2,"Jl. Kuningan Madya, RT.6/RW.2, Menteng Atas, Kota Jakarta Selatan",-6.2105597999999995,106.83236229999999,10.0
Nasi Goreng Iwan,5.0,2,"Gg. Cangkring 2 No.8, RT.8/RW.2, Tj. Bar., Kota Jakarta Selatan",-6.310012599999999,106.85150520000002,10.0
nasi goreng mamat,5.0,2,"Jl. Batu I, RT.4/RW.1, Pejaten Tim., Kota Jakarta Selatan",-6.2679348,106.84725890000001,10.0
NASI GORENG BANG SUENO,5.0,2,"Jl. Sawo Kecik Raya No.4, RT.4/RW.4, Bukit Duri, Kota Jakarta Selatan",-6.2211929,106.85532099999999,10.0
Nasi Kucing A6,5.0,2,"Jl. Raya Condet No.82, RT.5/RW.2, Balekambang, Kota Jakarta Timur",-6.2807112,106.85502220000001,10.0
"NASI GORENG KEBULI KAMBING PASAR MINGGU, PEJATEN BARAT",5.0,2,"Gg. Majlista'lim No.5, RT.5/RW.7, Pejaten Bar., Kota Jakarta Selatan",-6.2773079,106.83413390000001,10.0
Nasi Goreng Teladan,5.0,2,"RT.15/RW.2, RT.15/RW.2, Kuningan, Karet, Kota Jakarta Selatan",-6.213228599999999,106.8249962,10.0
"warung Gokar ""Goreng Bakar""",5.0,2,"Jalan Pagu Jaten Raya No.19, RT.16/RW.6, Pejaten Tim., Kota Jakarta Selatan",-6.280357,106.846418,10.0
Nasi Goreng Gila Miptahudin,5.0,2,"RT.8/RW.6, Pegangsaan, Central Jakarta City",-6.2036989999999985,106.85061670000002,10.0
MINI RESTO AREMA,5.0,2,"Jalan 1 RT 002 RW 04 No 37 Pondok Cabe Pamulang, Pd. Cabe Ilir, Kota Tangerang Selatan",-6.326443,106.767048,10.0
Warung Tikungan,5.0,2,"Jl. Tegal Parang Selatan 3, RT.7/RW.4, Tegal Parang, Kota Jakarta Selatan",-6.2486343,106.83455020000001,10.0
Aneka Nasi Goreng,5.0,2,"L3 , Pejaten Village , JL. Pajetan Raya, Jati Padang , 2 , Pasar Minggu , 12510 Jakarta Selatan , DKI Jakarta, RT.1/RW.5, Jati Padang, South Jakarta City",-6.279806400000001,106.8292212,10.0
Nasi Goreng Barokah,3.3,3,"Jl. Denpasar No.6, RT.6/RW.7, Kuningan, Karet Kuningan, Kota Jakarta Selatan",-6.2193041,106.8301912,9.899999999999999
Nasi Goreng Pak Aldi,3.3,3,"Jl. H. Misan Riman No.1C, RT.2/RW.4, Kukusan, Kota Depok",-6.3606634999999985,106.81671019999999,9.899999999999999
Nasi Goreng Bang Dimas,3.3,3,"no. beji depok, Jl. H. Amat No.31, Kukusan, Kota Depok",-6.35996,106.819973,9.899999999999999
Nasi Goreng Gila Khas Jakarta Plaza Semanggi,2.3,4,"Foodcourt Plaza Semanggi, Jl. Jend. Sudirman No.50, RT.1/RW.4, Karet Semanggi, Kota Jakarta Selatan",-6.2203237,106.81426499999999,9.2
Nasi Goreng Mertakanda Kebumen Bang Udin,4.5,2,"Gg. Tauladan, Jl. Bendungan Hilir No.11, RT.11/RW.5, Karet Tengsin, Kota Jakarta Pusat",-6.2075057000000005,106.81241770000001,9.0
Nasi Goreng Putra Poncol,4.5,2,"Jl. Pahlawan, RT.02/RW.09, Cinangka, Kota Depok",-6.3678357000000005,106.756569,9.0
NASI GORENG COYYY,4.5,2,"Raya Ciputat Timur, Jl. Raya Cirendeu, Pisangan, Kota Tangerang Selatan",-6.321062299999999,106.7682622,9.0
Nasgor Putra Arjuna,4.5,2,"Jl. Karang Tengah Raya No.10, RT.6/RW.3, Lb. Bulus, Kota Jakarta Selatan",-6.3142014999999985,106.78159679999999,9.0
nasi goreng bang adin,4.5,2,"Jl. Patal Senayan, RT.5/RW.7, Grogol Utara, Kota Jakarta Selatan",-6.2187538,106.7950639,9.0
Nasi Goreng Andara,3.0,3,"RT.1/RW.3, Pondok Labu, South Jakarta City",-6.314013200000001,106.8035027,9.0
Nasi Goreng Gondrong,4.5,2,"Jl. Raya Jakarta-Bogor No.2d, RT.8/RW.2, Rambutan, Kota Jakarta Timur",-6.3023653999999985,106.86787690000001,9.0
Nasi Goreng Padang(PIAMAN LAWEH),4.5,2,"Jl. Kemandoran Pluis, RT.6/RW.14, Grogol Utara, Kota Jakarta Selatan",-6.2104133,106.79225159999999,9.0
Nasi Goreng Spesial Kwetiau Akang,4.5,2,"Jalan Pintu Senayan 1 Floor 5 Fx Sudirman Gelora Tanah Abang, Jakarta Pusat, RT.1/RW.3, Gelora, Kota Jakarta Pusat",-6.224394999999999,106.804002,9.0
Nasi Goreng Sedap Rasa,4.5,2,"Jl. Harsono RM No.15A, RW.7, Ragunan, Kota Jakarta Selatan",-6.300792400000001,106.82110320000001,9.0
Warung Nasi Goreng Mawuut,4.5,2,"No. 82 Kecamatan Palmerah, Kelurahan, Jl. Raya Kb. Jeruk, RT.9/RW.15, Palmerah, Kota Jakarta Barat",-6.202045999999998,106.78276100000001,9.0
Nasi Goreng PakDe,4.5,2,"RT.3/RW.5, Jagakarsa, South Jakarta City",-6.322000999999998,106.81881000000001,9.0
Nasi / Mie Goreng Unyil,4.5,2,"RT.6/RW.2, West Cilandak, South Jakarta City",-6.2970099,106.8026933,9.0
Nasi Goreng Mawar Moncer,4.5,2,"Jl. H. Marsaid No.12, Kemiri Muka, Kota Depok",-6.3751029,106.83193610000001,9.0
Nasi Goreng Ortega,4.5,2,"Jalan Meruya Selatan Rt 07 Rw 04 Nomor 118 B, Meruya Selatan, Kembangan, RT.4/RW.1, Meruya Sel., Kota Jakarta Barat",-6.208405,106.737909,9.0
Nasi Goreng Riri,4.5,2,"Jl. Asem No.20, RT.8/RW.1, Cijantung, Kota Jakarta Timur",-6.3261791,106.86330890000002,9.0
Nasi Goreng Sembayu,4.5,2,"Jl. Tegalan No.10-6, RT.9/RW.3, Palmeriam, Kota Jakarta Timur",-6.2020611,106.8580706,9.0
Nasi Goreng Haji Echo,4.5,2,"Cempaka Putih, South Tangerang City",-6.2957059,106.74926440000002,9.0
Nasi Goreng Mas Dul,4.5,2,"Jl. H. Hasan, RT.5/RW.2, Baru, Kota Jakarta Timur",-6.325676899999999,106.8501976,9.0
Nasi Goreng Padang,4.5,2,"Jl. Makmur No.22-3, RT.9/RW.1, Susukan, Kota Jakarta Timur",-6.309527099999999,106.8640805,9.0
NASI GORENG UMAR cah Tegal,4.5,2,"Jl. Tanah Cimo No.18, Tanah Baru, Kota Depok",-6.3710702,106.7985815,9.0
Nasi Goreng Asli Malang,4.5,2,"No., Jl. Gotong Royong No.20, RT.004/RW.001, Larangan Indah, Kota Tangerang",-6.229680099999999,106.7343493,9.0
Nasi Goreng Dek Rayhan,4.5,2,"Jl. Ikan Terbang Blok A20 No.1, Jurang Manggu Tim., Kota Tangerang Selatan",-6.2655458999999984,106.73445829999999,9.0
Nasi Goreng Brebes,3.0,3,"Jl. Pengadegan Utara, RT.1/RW.8, Pengadegan, Kota Jakarta Selatan",-6.2473044999999985,106.84769309999999,9.0
Pondok Gilar Gilar,4.5,2,"Jl. Sirsak No.8, RT.8/RW.7, Jagakarsa, South Jakarta City",-6.3352543,106.8235703,9.0
NasGor Rody,4.5,2,"Jl. Radio Dalam Raya No.14 A, RT.5/RW.14, Gandaria Utara, Kota Jakarta Selatan",-6.259245,106.78935800000001,9.0
Dapur 83 Nasi Goreng Bang Roy,4.5,2,"Jl. Raya Inpres No.5, RT.5/RW.2, Kp. Tengah, Kota Jakarta Timur",-6.286379,106.86746000000001,9.0
Nasi Goreng Kang Nana,4.5,2,"RT.7, Cipulir, South Jakarta City",-6.237647900000001,106.77632009999999,9.0
Nasi Bebek&Ayam Goreng Bang Hanif,4.5,2,"Pasar Kebayoran Lama bawah, RT.1/RW.1, Kby. Lama Utara, Kota Jakarta Selatan",-6.2388856,106.78127190000001,9.0
Nasi Goreng Aziz,4.5,2,"Jl. H. Kodja Raya No.16, Kukusan, Kota Depok",-6.3634693,106.81659520000001,9.0
Warung nasi goreng raos & hot,4.5,2,"ps, Jl. Bintaro Permai Raya, RT.6/RW.2, Pesanggrahan, Kota Jakarta Selatan",-6.256523000000001,106.761096,9.0
Nasi Goreng Gila Mas Toha,4.5,2,"Jl. Juragan Sinda Raya No.12, RW.9, Kukusan, Depok City",-6.359584099999998,106.81732140000001,9.0
Nasi Goreng Jhon,4.5,2,"Jl. Duren Tiga Timur, RT.12, Rawajati, Kota Jakarta Selatan",-6.2538895,106.8495649,9.0
Nasi & Lauk Pauk,4.5,2,"Jl. Moch Kahfi II, RT.11/RW.8, Srengseng Sawah, Kota Jakarta Selatan",-6.3359727,106.82668829999999,9.0
Aa Nasi Goreng Aa,4.5,2,"Apotik Nusantara, Jl. Nusantara No.9, Tugu, Kota Depok",-6.3539587,106.8426388,9.0
Nasi Udug Malam Mak Ojak,4.5,2,"Jl. Swadaya No.30, RT.6/RW.10, Pejaten Tim., Kota Jakarta Selatan",-6.2896849999999995,106.8460254,9.0
Nasi Goreng Sedap Malam,4.5,2,"Jl. Moch. Kahfi II, RT.1/RW.1, Srengseng Sawah, Kota Jakarta Selatan",-6.332049700000001,106.8347548,9.0
Nasi goreng pak no (go biz),4.5,2,"Jl. RS. Fatmawati Raya No.2, RT.1/RW.3, South Gandaria, South Jakarta City",-6.268167,106.7970335,9.0
Nasi Goreng Gila Akrom,4.5,2,"Jl. KP.Dalam IV No.1, RT.3/RW.14, Kb. Baru, Kota Jakarta Selatan",-6.240644700000002,106.86086540000001,9.0
Nasi Goreng Bank Roy,4.5,2,"Gg. Asem, Pamulang Bar., Kota Tangerang Selatan",-6.3487073,106.7364347,9.0
Nasi Goreng & Bakmi Jawa BUMEN JAYA I,4.0,2,"Jl. Pejompongan Raya No.6, RT.4/RW.6, Bend. Hilir, Kota Jakarta Pusat",-6.203282,106.80271,8.0
Nasi goreng GEMETERAN,4.0,2,"Jl. Ulujami Raya No.8-23, RT.5/RW.2, Pesanggrahan, Kota Jakarta Selatan",-6.256015799999999,106.76305790000002,8.0
Nasi Goreng Betawi Lalan,4.0,2,"Jl. Bhakti Puspa No.1B Tanah Abang Jakarta Selatan DKI Jakarta, RT.2/RW.3, Rw. Bar., Kota Jakarta Selatan",-6.236361899999999,106.8125853,8.0
NASI GORENG Birah II,4.0,2,"Jl. Birah II No.1, RT.5/RW.6, Rw. Bar., Kota Jakarta Selatan",-6.237165,106.81518600000001,8.0
Nasi Goreng Mama And Seafood,4.0,2,"Kelurahan, RT.7/RW.1, Ps. Manggis, Kota Jakarta Selatan",-6.2117283,106.84250490000001,8.0
Nasi Goreng Anisa,4.0,2,"Jl. Moh. Kahfi 1 No.1, RT.6/RW.1, Cipedak, Kota Jakarta Selatan",-6.3501691,106.80159840000002,8.0
"Nasi Goreng ""SARI RASA""",4.0,2,"Jl. Tj. Barat Selatan No.Gg. 100, RT.1/RW.2, Tj. Bar., Kota Jakarta Selatan",-6.3127716,106.8400317,8.0
Nasi Goreng 'Cacang',4.0,2,"Jl. Sukun IX No.3, RT.5/RW.9, Pisangan Baru, Kota Jakarta Timur",-6.2090888,106.86389309999998,8.0
NasGor Kambing Abah,4.0,2,"Plaza Festival, Lt. UG Pintu Masuk Utara (seberang RS MMC) Jl. HR. Rasuna Said Kav. C. 22, Kawasan Epicentrum Kuningan, RT.16, Kuningan, Karet Kuningan, Kota Jakarta Selatan",-6.2208878,106.8319545,8.0
Nasi Goreng Ana Rasa,4.0,2,"Jl. Mampang Prapatan VI No.49, RT.8/RW.2, Tegal Parang, Kota Jakarta Selatan",-6.2466702000000005,106.82933770000001,8.0
nasi goreng wonogiri 99 mas bowo,4.0,2,"Jl. Bendungan Hilir No.130-126 11 3, RT.13/RW.6, Bend. Hilir, Kota Jakarta Pusat",-6.2077700999999985,106.8110645,8.0
NASGOR Kasah,4.0,2,"Jl. Srengseng Sawah No.49, RT.12/RW.9, Srengseng Sawah, Kota Jakarta Selatan",-6.357177,106.81255279999999,8.0
Kantin Nusa Palma,4.0,2,"Palma One Kav X, 2 No 4, Jl. Hr. Rasuna Said, RT.8/RW.4, Kuningan Tim., Kota Jakarta Selatan",-6.228073200000001,106.83345049999998,8.0
Nasi Goreng Ali,4.0,2,"Jl. Tanah Merdeka Gg. Swadaya No.16-18, RT.1/RW.5, Rambutan, Kota Jakarta Timur",-6.3038145,106.8684973,8.0
Nasi Goreng Coboy,4.0,2,"Jl. Aup Bar. I No.1, RT.1/RW.6, Jati Padang, Kota Jakarta Selatan",-6.2950281,106.8346465,8.0
Ayam Penyet Nasi Goreng Sore Malam,4.0,2,"No., Jl. Payakumbuh No.14, RT.1/RW.1, Ps. Manggis, Kota Jakarta Selatan",-6.214436999999998,106.84288319999999,8.0
Nasi Goreng Mas NO,4.0,2,"Jl. Sawo IV No.16, RT.8/RW.7, Manggarai Sel., Kota Jakarta Selatan",-6.2190438,106.8481558,8.0
Nasi Goreng Senyum Pak Jangkung,4.0,2,"Jl. Asia Afrika, RT.1/RW.3, Senayan, Kota Jakarta Pusat",-6.2282106000000015,106.79834879999999,8.0
Nasi Goreng MAS DOLI,3.5,2,"Jl. Legoso Raya, Pisangan, Kota Tangerang Selatan",-6.317085700000001,106.75392439999999,7.0
Siomay Bandung & Mendoan Goreng,3.5,2,"Jl. Akses Universitas Indonesia, No.44, Kelapa Dua, Tugu, Kota Depok",-6.3547106,106.84058610000001,7.0
Nasi Goreng Gila Artomoro,3.5,2,"Jl. Raya Pos Pengumben No.1, RT.12/RW.6, Klp. Dua, Kota Jakarta Barat",-6.2171880999999996,106.7610544,7.0
Nasi Goreng Grobak,3.5,2,"Jl. H. Kamang No.17, RT.6/RW.10, Pd. Labu, Kota Jakarta Selatan",-6.308177499999998,106.79259029999999,7.0
Lumpia Goreng Semarang,3.5,2,"Dapur Raya 2 Pasar Raya Blok M Lt LG, Jl. Iskandarsyah II, RT.3/RW.1, Melawai, Kota Jakarta Selatan",-6.2436300000000005,106.802449,7.0
Nasi Goreng Gila Toni 38,3.5,2,"Jl. Sigura-gura II, RT.12/RW.1, Duren Tiga, Kota Jakarta Selatan",-6.2585171,106.8337175,7.0
Spesial Nasi Goreng,3.5,2,"Jl. H. Mukhtar Raya No.50, RT.5/RW.11, Petukangan Utara, Kota Jakarta Selatan",-6.225707,106.747354,7.0
Nasi Goreng Doel,3.0,2,"Jl. H. Salim rt003/010, Tugu, Kota Depok",-6.360281099999999,106.8447898,6.0
Nasi Goreng Kumis,3.0,2,"Jl. Kemajuan No.23, RT.7/RW.2, Petukangan Sel., Kota Jakarta Selatan",-6.2427586999999995,106.75178020000001,6.0
Nasi Goreng Ngadio 2,3.0,2,"RT.5/RW.2, Selong, South Jakarta City",-6.2381571,106.80591000000001,6.0
Nasi Uduk Ayam&bebek Goreng,3.0,2,"Jl. Joglo Raya No.30, RT.7/RW.8, Joglo, Kota Jakarta Barat",-6.2198820999999995,106.74237179999999,6.0
Nasi Goreng Riki Palembang,3.0,2,"RT.9/RW.8, Pengadegan, South Jakarta City",-6.249450200000001,106.8488652,6.0
Nasi Goreng Mang Bagol,3.0,2,"Jl. Manggarai Utara 2 No.Rt 03, RT.6, Manggarai, Kota Jakarta Selatan",-6.2106255,106.84847659999998,6.0
Nasi Balap Puyung Haz Makmur,3.0,2,"Jl. Raya Jagakarsa No.52b, RT.2/RW.7, Jagakarsa, Kota Jakarta Selatan",-6.3267782,106.82147179999998,6.0
nasi goreng bang jay,3.0,2,"Jl. Raya Condet No.4, RT.5/RW.3, Balekambang, Kota Jakarta Timur",-6.2928728,106.8556176,6.0
Nasi Gorengan Mas Roy,3.0,2,"Jl. Kramat 2 No.71, RT.6/RW.1, Gunung, Kota Jakarta Selatan",-6.235824,106.78609080000001,6.0
Nasi goreng bejo,5.0,1,"Jalan raya condet samping gg h m izi rt09/05cililitan, RT.9/RW.5, Kramat Jati, Kota Jakarta Timur",-6.2653919999999985,106.86207900000001,5.0
Nasi Goreng Tegalan,5.0,1,"Jl. Tegalan No.1, RW.4, Palmeriam, Kota Jakarta Timur",-6.2025754,106.8578162,5.0
Nasi Goreng Keraton,5.0,1,"Jl. Raya Jagakarsa No.10F, RT.9/RW.3, Jagakarsa, Kota Jakarta Selatan",-6.3295561,106.82532379999999,5.0
Nasi goreng ERVE,5.0,1,"Jl. H. Compek No.42, RT.9/RW.1, Srengseng Sawah, Jakarta",-6.3536779999999995,106.833933,5.0
Nasi Goreng Mas Gambreng,5.0,1,"Unnamed Road, Pangkalan Jati, Kota Depok",-6.3223628,106.7956993,5.0
Nasi Goreng Blinger,5.0,1,"Kios Taman Pondok Labu, Jalan RS Fatmawati, RT.5/RW.1, Pd. Labu, Kota Jakarta Selatan",-6.313746900000001,106.7940063,5.0
Nasi & Mie Goreng Cakep Jaya,5.0,1,"Jl. Pangkalan Jati 2 No.18, Pangkalan Jati, Kota Depok",-6.318263399999998,106.793144,5.0
Nasi Goreng CITRA KHAS MALAM,5.0,1,"Jl. Langga Raya No.85, RT.13/RW.2, Lenteng Agung, Kota Jakarta Selatan",-6.322875,106.83718799999998,5.0
nasi goreng bukit sutera,5.0,1,"Jl. Terusan H. Nawi Malik, Serua, Kota Depok",-6.371095400000001,106.73069620000001,5.0
NASI GORENG AYAM JOSS,5.0,1,"Jl. Kemuning Raya No.25, RT.8/RW.6, Pejaten Tim., Kota Jakarta Selatan",-6.2741772000000005,106.84698229999998,5.0
Nasgor Budi,5.0,1,"Jl. Danau Toba No.85, RT.13/RW.3, Bend. Hilir, Kota Jakarta Pusat",-6.2083945,106.8095696,5.0
Nasi goreng idolaku,5.0,1,"Jl. Karet Ps. Baru Barat VII No.27, RT.5/RW.7, Karet Tengsin, Kota Jakarta Pusat",-6.2048489,106.81041880000001,5.0
Nasi Goreng Bang Jidin,5.0,1,"Jalan Muhammad Kafi 1 No.4-6 4 1, RT.4/RW.1, Cipedak, Kota Jakarta Selatan",-6.3454163,106.8034499,5.0
Nasi Goreng Bang Juli,5.0,1,"Jl. Pesantren No.15, RW.003, Jurang Manggu Tim., Kota Tangerang Selatan",-6.2531846,106.73125470000001,5.0
"Nasi Goreng Mas Gondrong, Sedia Nasgor Special Ati Ampela dll",5.0,1,"Lebak Bulus, South Jakarta City",-6.3158634000000005,106.7821902,5.0
Nasi Rempah,5.0,1,"Jl. Karang Tengah Raya No.12, RT.6/RW.3, Lb. Bulus, Kota Jakarta Selatan",-6.3143283000000014,106.7817607,5.0
Nasi Goreng Barokah Jaya,5.0,1,"RT.1/RW.2, Pekayon, East Jakarta City",-6.3452831,106.8674764,5.0
Nasi Goreng,5.0,1,"Jl. Bangka II No.48, RT.1/RW.3, Pela Mampang, Kota Jakarta Selatan",-6.246887,106.81885759999999,5.0
Nasi Goreng SLAMET,5.0,1,"seberang seafood 99)/dian salon, Jl. Komp. Bappenas Siaga Raya No.25, RT.4/RW.4, Pejaten Bar., Kota Jakarta Selatan",-6.2719457,106.8380848,5.0
Nasi Goreng Kambing Kebon Sirih Sejak 1958 - Pasaraya Grande,5.0,1,"Dapur Raya Pasaraya Grande Lantai LG #W1, Jl. Iskandarsyah Raya, RT.3/RW.1, Melawai, Kota Jakarta Selatan",-6.243940599999998,106.8029057,5.0
nasi goreng,5.0,1,"Jl. Rw. Belong No.23, RW.7, Palmerah, Kota Jakarta Barat",-6.2046223,106.7829254,5.0
Nasi Goreng Indomaret Kemandoran 1,5.0,1,"Jl. Kemandoran I No.13, RT.2/RW.3, Grogol Utara, Kota Jakarta Selatan",-6.2133066,106.7907656,5.0
Nasi Goreng Dhenok 03,5.0,1,"Jl. Pendidikan III No.06B, RT.1/RW.4, Cijantung, Kota Jakarta Timur",-6.3133149999999985,106.861845,5.0
Warung Nasi Goreng Citra Sunda,5.0,1,"Jl. Tanah Baru I No.9, RT.6/RW.13, Grogol Utara, Kota Jakarta Selatan",-6.2134566,106.786188,5.0
Nasi Gulf Siram,5.0,1,"Jl. Curug Agung, Tanah Baru, Kota Depok",-6.3685611999999985,106.79858020000002,5.0
Nasi Goreng Gila Bang Doel,5.0,1,"Jalan Kebon Kelapa, RT.1/RW.11, Utan Kayu Sel., Kota Jakarta Timur",-6.2059165,106.866051,5.0
Nasi Goreng Pekalongan,5.0,1,"Jl. Moh. Kahfi 1 RT.4/RW.6 Cipedak Kec. Jagakarsa, Kota Jakarta Selatan, Daerah Khusus Ibukota Jakarta, RT.6/RW.4, Cipedak, Kota Jakarta Selatan",-6.347980000000001,106.8022081,5.0
"Nasi Goreng & Pecel Lele ""MARJAN""",5.0,1,"RT.3/RW.5, Kalibata, Kota Jakarta Selatan",-6.2712675,106.83077469999999,5.0
Nasi Goreng Hery,5.0,1,"Gg. Cemara Blok Upu No.333, RT.2/RW.5, Lenteng Agung, Kota Jakarta Selatan",-6.329663,106.83381999999999,5.0
