Name,Rating,NumberOfUser,Address,lat,lon,X
Nasi Goreng Kebuli Apjay Pak Ivan Panglima Polim IX,4.4,1786,"Jl panglima polim lX no 18 depan Alfa Midi No 18 rt02/07 kel melawai Keluhan, RT.2/RW.7, Melawai, Kota Jakarta Selatan",-6.249885,106.799555,7858.400000000001
Pondok Nasi Kebuli Ibu Hanna,4.4,1102,"Jl. KH. Abdullah Syafei No.42, RT.12/RW.9, Bukit Duri, Kota Jakarta Selatan",-6.2248831,106.8629074,4848.8
Warung Bhakti,4.2,845,"Jalan Bhakti Blok S, RT.11/RW.1, Rw. Bar., Kota Jakarta Selatan",-6.2332407,106.81512240000002,3549.0
Nasi Goreng Kambing Kebon Sirih - Bona Indah,4.3,794,"Jl. Karang Tengah Raya No.1C, RW.4, Lb. Bulus, Kota Jakarta Selatan",-6.3048331,106.781503,3414.2
Nasi Goreng MAFIA Tebet,4.1,758,"Jl. Tebet Raya No.27D, RT.1/RW.2, Tebet Tim., Kota Jakarta Selatan",-6.22939,106.8532221,3107.7999999999997
Nasi Goreng Bang H. ZEN,4.4,482,"Jl. Ciledug Raya, RT.11/RW.11, Cipulir, Kota Jakarta Selatan",-6.2382461,106.7741878,2120.8
Warung Apjay,4.3,429,"Panglima Polim St No.9, RT.2/RW.7, Pulo, South Jakarta City",-6.2498311,106.79980490000001,1844.6999999999998
Warpopski,4.7,378,"Jl. Tebet Timur Dalam Raya No.6A, Tebet Tim., Kota Jakarta Selatan",-6.2320989,106.85366570000001,1776.6000000000001
Nasi Goreng NUSANTARA,4.7,347,"Jl. Pahlawan No.8-10, Rempoa, Kota Tangerang Selatan",-6.296471700000001,106.75802350000001,1630.9
Nasi Goreng Nusantara Mpok Yani Rempoa,4.8,309,"Jl. Pahlawan No.37 D, Cemp. Putih, Kota Tangerang Selatan",-6.296554299999999,106.75787520000002,1483.2
Alahap,4.4,331,"Jl. Benda No.20c, RT.6/RW.4, Cilandak Tim., Kota Jakarta Selatan",-6.2757282,106.8158695,1456.4
Pondok Selera Amigos,4.5,314,"Jl. M. Kahfi 1 Jl. Cluster Kebagusan 3 No.51 A, RT.7/RW.1, Jagakarsa, Kota Jakarta Selatan",-6.335483900000001,106.83147340000002,1413.0
Republic Nasi Goreng,4.4,318,"No.9, Jl. Mampang Prapatan VI No.2, RT.1/RW.2, Tegal Parang, Kota Jakarta Selatan",-6.246843599999999,106.8269291,1399.2
Nasi Goreng Karee,4.4,284,"Jl. Klp. Dua Raya Blok A No.26, Tugu, Kota Depok",-6.3715199,106.84276940000001,1249.6000000000001
Nasi Goreng MPR,4.4,263,"Jl. RS. Fatmawati Raya No.16A, RT.1/RW.4, Gandaria Sel., Kota Jakarta Selatan",-6.269614700000001,106.79724540000001,1157.2
Warung Nasi goreng Jengkol,4.3,261,"Jl. Manggarai Utara 2 No.17, RT.15/RW.4, Manggarai, Kota Jakarta Selatan",-6.2096882,106.8504729,1122.3
Nasi Goreng Pekalongan H. Mualimin,4.4,247,"Jl. RS. Fatmawati Raya No.222.E, RW.10, Pd. Labu, Kota Jakarta Selatan",-6.307706599999999,106.79341570000001,1086.8000000000002
Nasi Goreng Cabe Rawit Daksa II,4.3,252,"Jl. Daksa 2 No.mor 22, RT.4/RW.2, Selong, Kota Jakarta Selatan",-6.234248900000001,106.80685249999999,1083.6
Nasi Goreng Kambing Kebon Sirih,4.2,253,"Pasaraya Grande, Jl. Iskandarsyah Raya No.3, RT.3/RW.1, Melawai, Kota Jakarta Selatan",-6.243946999999999,106.80290500000001,1062.6000000000001
nasi goreng polonia,4.4,196,"Jl. Otista Raya No.29, RT.7/RW.8, Bidara Cina, Kota Jakarta Timur",-6.2377129999999985,106.86906200000001,862.4000000000001
Nasi Goreng Warna Warni Ijo Thole,4.4,195,"Jalan Panglima Polim V No. 4, Pulo, Kebayoran Baru, RT.1/RW.6, Melawai, Kota Jakarta Selatan",-6.2464578999999985,106.79838400000001,858.0000000000001
Nasi Goreng Gila Bahari,4.2,197,"Jl. Lontar VII No.10, RT.3/RW.5, Menteng Atas, Kota Jakarta Selatan",-6.218893799999999,106.83786780000001,827.4000000000001
Warung Makan Muncul Malam,4.3,191,"Jl. RC. Veteran Raya No.62, Bintaro, Kota Jakarta Selatan",-6.2632793,106.76652340000001,821.3
Mbah Suro Pakde,4.5,167,"Jl. RS. Fatmawati Raya No.11, RW.8, Pd. Labu, Kota Jakarta Selatan",-6.3024622,106.79491100000001,751.5
Love Eat Cafe,4.3,173,"Jl. Penjernihan II No.04, RT.11/RW.6, Bend. Hilir, Kota Jakarta Pusat",-6.2050312000000005,106.80928940000001,743.9
Nasi Goreng Pocin,4.3,171,"No. Beji, Jl. Margonda Raya No.395, Pondok Cina, Kota Depok",-6.370422400000002,106.83330959999999,735.3
Nasi Goreng Kare,4.5,162,"Jl. Garuda No.15, Pasir Gn. Sel., Kota Depok",-6.3425859,106.84945890000002,729.0
Nasi Gila Stress & Nasi Goreng N'Dut,4.2,172,"Jl. Gandaria 1 No.342, RT.5/RW.9, Kramat Pela, Kota Jakarta Selatan",-6.2425082000000005,106.78773329999999,722.4
Solaria,4.1,173,"Jl. Sultan Hasanudin No.1, RT.3/RW.1, Melawai, Kota Jakarta Selatan",-6.244110300000001,106.80113259999999,709.3
Nasi Goreng Karee Abang Gandul,4.6,146,"Jl. Mesjid Al-Akhyar No.4, Gandul, Kota Depok",-6.3303148999999985,106.7940975,671.5999999999999
Nasi Goreng Gila Ceria Mart,4.2,156,"Jl. Kalibata Timur No.80, RT.1/RW.10, Kalibata, Kota Jakarta Selatan",-6.2622182,106.8490666,655.2
Kedai NGRT,4.3,149,"Jl. Guru Mughni No.2, RT.5/RW.1, Kuningan, Kuningan Tim., Kota Jakarta Selatan",-6.2267459,106.82166480000001,640.6999999999999
Kedai Back Madun,4.5,140,"Jl. Pamulang Permai 1 No.A. 20, West Pamulang, South Tangerang City",-6.3330895,106.73262659999999,630.0
Nasi Goreng Kambing H. Salim Radio dalam,4.3,134,"Jl. Radio Dalam Raya No.47 A, RT.5/RW.14, Gandaria Utara, Kota Jakarta Selatan",-6.260496400000001,106.78901409999999,576.1999999999999
Nasi Goreng Pak Metal,4.3,134,"Jl. H. Batong Raya No.4, RT.7/RW.6, Cilandak Bar., Kota Jakarta Selatan",-6.2867676,106.79044540000001,576.1999999999999
Kantin Caringin,4.4,126,"Jl. Caringin Timur No.41, RT.1/RW.5, Cilandak Bar., Kota Jakarta Selatan",-6.2859837999999995,106.79334750000001,554.4000000000001
Nasi Goreng D'Awak,4.6,119,"Blok Herman SP1, Jl. Raya Jakarta-Bogor No.26, RT.2/RW.5, Susukan, Kota Jakarta Timur",-6.3039401,106.8666382,547.4
Bebek Dower,3.9,139,"Pejaten Village Mall Lt. 2, Jl. Warung Jati Barat No.39, RT.1/RW.5, Jati Padang, Pasar Minggu, RT.1/RW.5, Jati Padang, Kota Jakarta Selatan",-6.2802109,106.82943,542.1
Nasi Goreng Gila Palbatu 2 - Sandi Jaya,4.4,116,"Jl. Pal Batu 2 No.67, RT.7/RW.4, Menteng Dalam, Kota Jakarta Selatan",-6.2274433,106.84481840000001,510.40000000000003
Nasi Goreng Suwarto,4.6,110,"Jl. Legoso Raya, Pisangan, Kota Tangerang Selatan",-6.3195188999999985,106.75474240000001,505.99999999999994
Nasi Goreng Gila Mas Roni,4.3,115,"Jalan Kelapa Dua Raya RT.1/RW.2, Kelapa Dua, Kebon Jeruk, RT.7/RW.1, Klp. Dua, Kota Jakarta Barat",-6.2091268,106.7690477,494.5
Pondok Selera,4.4,110,"Jl. Akses UI No.27, Tugu, Kota Depok",-6.354805000000001,106.8454206,484.00000000000006
Nasi Goreng Kambing Bang Arifin Cabang Kebon Sirih,4.2,115,"Jl. RE Martadinata No.1, Cipayung, Kota Tangerang Selatan",-6.3212782,106.7491789,483.0
Nasi Goreng Gila,4.5,107,"No., Jl. Ampera Raya No.6, RT.5/RW.2, Ragunan, DKI Jakarta",-6.288650199999998,106.8184061,481.5
Nasi Goreng Kambing Kebon Sirih Sejak 1958 - Pajajaran,4.2,113,"Jl. Pajajaran No.45, Pamulang Bar., Kota Tangerang Selatan",-6.3401754,106.7385469,474.6
Nasi Gila Pangpol,4.3,110,"Jl. Wijaya VI, RT.2/RW.5, Melawai, Kota Jakarta Selatan",-6.246316999999999,106.80108770000001,473.0
Nasi Goreng Mekarsari,4.4,107,"Jl. Puri Sakti II No.3, RT.9/RW.1, Cipete Sel., Kota Jakarta Selatan",-6.257341599999998,106.81450509999999,470.8
PAK MIN WARKIS,4.9,96,"Jl. Diesel No.3, RW.2, Lb. Bulus, Kota Jakarta Selatan",-6.2924763,106.7697318,470.40000000000003
Nasi Goreng Atam,4.6,97,"Jl. Matraman Dalam III No.13, RT.11/RW.7, Pegangsaan, Kota Jakarta Pusat",-6.2057423,106.85389009999999,446.2
Nasi Goreng Spesial Ibu Hj. Cicih Pasar Kebayoran Lama,4.7,93,"Jl. Ciledug Raya No.14 M, RT.6/RW.1, Cipulir, Kota Jakarta Selatan",-6.238510199999999,106.77819380000001,437.1
Nasgor Mas Roy,4.5,96,"Jl. Dr. Setiabudi, blok asem, Pamulang Bar., Kota Tangerang Selatan",-6.3491838,106.7408815,432.0
Nasi Goreng Mas Kentung,4.5,96,"Jalan Pahlawan RT 04 RW 07 No 40C Sawangan, Kedaung, Kota Depok",-6.3661303,106.75029939999999,432.0
nasi goreng gila keju mas bro 67,4.5,94,"Jl. Kol. Pol Pranoto No.55, Tugu, Kota Depok",-6.3486126,106.8516021,423.0
Nasi Goreng Sukabumi,4.2,100,"Jalan Radio Dalam Raya RT 02 RW 09 Nomor 21B Gandaria Utara Kebayoran Baru, Jakarta Selatan, RT.1/RW.9, Gandaria Utara, Kota Jakarta Selatan",-6.2533458999999985,106.79114779999999,420.0
Nasi Goreng Pojok Pak Gendut,4.5,93,"Pusat Jajanan Kuliner Kampung Kandang # Jagakarsa, Jl. Raya Cilandak Kko No.5, RT.6/RW.6, Ragunan, Kota Jakarta Selatan",-6.3107533999999985,106.8142034,418.5
Nasi Goreng Barokah Pak Slamet,4.4,93,"1, Jl. Srengseng Raya No.7 C, RW.5, Srengseng, Kota Jakarta Barat",-6.2057240999999985,106.75821189999999,409.20000000000005
Nasi Goreng Gondrong Sedap Sehati,4.7,86,"Jl. H. Nawi Raya No.1 C, RT.7/RW.7, Gandaria Utara, Kota Jakarta Selatan",-6.2641449,106.7940778,404.2
Nasi Goreng Kambing,4.3,93,"Jalan Soepomo, Tebet, RT.4/RW.1, Menteng Dalam, Kota Jakarta Selatan",-6.2411807999999995,106.8446277,399.9
NASI MONYET,4.6,83,"Jl. Batu Merah No.39, RT.4/RW.2, Pejaten Tim., Kota Jakarta Selatan",-6.2649792,106.8499545,381.79999999999995
Nasi Goreng Echo,4.4,84,"Jl. Anggrek No.26C, RT.2/RW.11, Cinere, Kota Depok",-6.3465735,106.7815304,369.6
Nasi Goreng Kebuli Bom Bom,4.4,84,"Jl. Gandaria Tengah I No.2, Kramat Pela, Kota Jakarta Selatan",-6.2451184999999985,106.789004,369.6
Nasi Goreng Gila Bilqis,4.4,81,"Gg. Sabar No.5, RT.8/RW.4, South Petukangan, South Jakarta City",-6.2409789999999985,106.752478,356.40000000000003
Nasi Goreng Kambing Waroeng Djakarta Pak Yan,4.7,75,"Ruko Sing Asri No 28 Ciputat, Jalan Merpati Raya, Sawah Lama, Ciputat, Sawah Lama, Kota Tangerang Selatan",-6.299338,106.732432,352.5
Nasi Goreng Kebuli ABA 151 Rawajati,4.8,73,"Jl. Rawajati Tim. III No.38, RW.2, Rawajati, Kota Jakarta Selatan",-6.2599602,106.855313,350.4
Nasi Goreng Sedap Malam Bang Sanip Susukan,4.4,79,"Jl. H. Jusin ,gang to'ong riih No.7, RT.11/RW.1, Susukan, Kota Jakarta Timur",-6.3141105,106.86519080000001,347.6
NASI GORENG GILA ARBEE,4.5,77,"Jl. Mampang Prapatan IV No.19, RT.5/RW.5, Mampang Prpt., Kota Jakarta Selatan",-6.245371400000001,106.82728590000002,346.5
Nasi Goreng Yasmin,4.6,75,"Jl. Ki Hajar Dewantara Gg. Nurul Huda III No.depan, Ciputat, Kota Tangerang Selatan",-6.3074423,106.74775670000001,345.0
Nasi Goreng Pak' de Karwo volvo,4.2,82,"Jl. Purbaya No.57, RT.11/RW.5, Pejaten Tim., Kota Jakarta Selatan",-6.2726182,106.8468764,344.40000000000003
RADJA NASI GORENG,4.4,73,"Jl. Yaktapena Raya, Pd. Ranji, Kota Tangerang Selatan",-6.2863164000000005,106.74162050000001,321.20000000000005
Warung Gelo,4.2,76,"Jl. RS. Fatmawati Raya No.11c, RT.6/RW.10, Pd. Labu, Kota Jakarta Selatan",-6.308674,106.7936033,319.2
Nasi Goreng Laris Jaya,4.5,70,"Jl. H. Domang No.59-10, Kb. Jeruk, Kota Jakarta Barat",-6.2022414,106.7705337,315.0
Nasi Goreng Liem,4.5,70,"Jl. Dharmawangsa Raya No.39b, RT.4/RW.2, Pulo, Kota Jakarta Selatan",-6.2537211,106.80318319999999,315.0
Pondok Selera,4.2,75,"Blok, Jl. Margonda Raya Blok Lengkeng No.13A, Kemiri Muka, Depok City",-6.3708228999999985,106.8335387,315.0
Nasi Goreng Bang Fandi,4.7,67,"KeDe Kantine Pak Johan F, Jl. Kemandoran I Jl. Pulo Kamboja No.26, RT.4/RW.6, Grogol Utara, DKI Jakarta",-6.215649,106.792763,314.90000000000003
Nasi Goreng Gila 28,4.3,71,"Jl Raya Ragunan No P5 RT 02/03 (Depan SMAN 28, RT.1/RW.3, Jati Padang, Kota Jakarta Selatan",-6.2862335,106.833106,305.3
Nasi Goreng Tip Top,4.3,71,"No., Jl. Kemanggisan Raya No.23, RT.2/RW.11, Palmerah, Kota Jakarta Barat",-6.200838099999999,106.78758429999999,305.3
Nasi Goreng CHANDRA,4.5,67,"Jl. Attahiriyah No.23, RT.10/RW.3, Pejaten Bar., Kota Jakarta Selatan",-6.2707557000000005,106.8413067,301.5
Nasi Goreng Fatmawati,4.5,67,"Jl. H. Abdullah No.29 A, RT.4/RW.3, Sukabumi Sel., Kota Jakarta Barat",-6.2214014,106.771868,301.5
Nasi Goreng Kebuli Safinah,4.7,64,"Jl. Cinere Raya, Limo, Kota Depok",-6.3482028,106.77636609999999,300.8
Nasi Goreng Anas,4.8,61,"Jl. Mujair Raya No.11, RT.4/RW.9, Jati Padang, Kota Jakarta Selatan",-6.297394300000001,106.8349633,292.8
Nasi Goreng Suramadu Cak Heri,4.7,61,"Jl. Raya Cirendeu No.107, Pisangan, Kota Tangerang Selatan",-6.324959099999999,106.7671175,286.7
Nasi Goreng Kebuli Apjay,4.3,65,"Jl. Cipete Raya No.3, Cipete Sel., Kota Jakarta Selatan",-6.2772337,106.79850520000001,279.5
Nasi Goreng Band Tumand,4.6,60,"Jl. Pepaya raya no.40 abcd, Dekat pepaya 5, RT.3/RW.5, Jagakarsa, Kota Jakarta Selatan",-6.3210191,106.8185294,276.0
Nasi Goreng Gila Pakde Budi,4.5,61,"Jl. Malang No.2, RT.6/RW.7, Menteng, Kota Jakarta Pusat",-6.2034097,106.838935,274.5
Omma Kafei,4.4,61,"Jalan Adiyaksa Blok L No.12A, RT.11/RW.7, Lb. Bulus, Kota Jakarta Selatan",-6.293589900000001,106.7795412,268.40000000000003
Nasi Goreng Barokah Cililitan,4.4,61,"Jl. Kecil III No49, RT.14 RW.07,Cililitan, RT.14/RW.7, Cililitan, Kota Jakarta Timur",-6.2599655,106.86142099999999,268.40000000000003
Nasi Goreng El-Syifa' Gg.Atas,4.4,60,"Jl. Kebagusan II Gg.Atas No.9, RT.9/RW.6, Kebagusan, Kota Jakarta Selatan",-6.3066928,106.82799170000001,264.0
Nasi Goreng Gila Tegal Bahari,4.6,57,"Jl. Asem Baris Raya No.52, RW.5, Kb. Baru, Kota Jakarta Selatan",-6.2257984,106.85904520000001,262.2
Nasi Goreng Jengkol,4.5,58,"Jl. Al Mubarok No.mor 33, RT.1/RW.2, Joglo, Kota Jakarta Barat",-6.219093,106.729991,261.0
Nasi Goreng Kabita,4.3,60,"Jl. Palakali No.59, Kukusan, Kota Depok",-6.3684995,106.81842990000001,258.0
Waluma,4.5,56,"Jl. Warga No.7, RT.3/RW.3, Pejaten Bar., Kota Jakarta Selatan",-6.272781500000001,106.84556979999999,252.0
DEPOT NASI GORENG XOPLAX,4.7,53,"Jalan kalimangso rt. 04 rw. 01 No.45 Kel, Jurang Manggu Tim., Kota Tangerang Selatan",-6.2665533,106.73411429999999,249.10000000000002
Nasi Goreng Berhias,4.5,54,"Jl. Pahlawan No.9D, RT.4/RW.4, Sukabumi Sel., Kota Jakarta Barat",-6.223857,106.77105900000001,243.0
Nasi goreng Pak Gated,4.5,54,"Jl. Kumbang No.12-13, RT.9/RW.6, Cililitan, Kota Jakarta Timur",-6.269032900000001,106.8608443,243.0
Rumah Makan Sekar Arum,4.5,53,"Jl. Kalibata Timur I No.60, RT.2/RW.8, Kalibata, Kota Jakarta Selatan",-6.259167,106.84642590000001,238.5
Nasi Goreng Putra Bawang,4.4,54,"Jl. Ceger Raya No.72, Jurang Manggu Tim., Kota Tangerang Selatan",-6.262884,106.733833,237.60000000000002
Nasi Goreng Pucung,4.3,55,"Jl. Pucung No.6, RT.2/RW.4, Balekambang, Kota Jakarta Timur",-6.2786083,106.85090770000001,236.5
nasi Kebuli Bang Wawan,4.6,51,"Jl. Aren II, Pd. Betung, Kota Tangerang Selatan",-6.259270900000001,106.74919399999999,234.6
"Nasi Mandhi ""Affagy""",4.3,54,"Jl. Raya Condet No.37, RT.3/RW.4, Balekambang, Kota Jakarta Timur",-6.2796731,106.8549669,232.2
RM. Nasi Alo,4.2,55,"Pondok Cina, Depok City",-6.363216099999999,106.8298487,231.0
NASI GORENG pugag tunggal jaya,4.4,52,"Jl. Kemandoran I No.25, RT.5/RW.16, Grogol Utara, Kota Jakarta Selatan",-6.2119751,106.7904926,228.8
Nasi Goreng (malam) Niki Eco,4.6,48,"Jl. Rumbut No.9A, Tugu, Kota Depok",-6.347207,106.8518994,220.79999999999998
Nasi Goreng Yonker,4.5,49,"Jl. Petogogan II No.8b, RT.9/RW.5, Pulo, Kota Jakarta Selatan",-6.254671,106.79640619999999,220.5
NASI GORENG GILA MAS JAWIR,4.5,48,"Jl. Klp. Dua Raya No.81, Tugu, Kota Depok",-6.3705501999999985,106.8427108,216.0
Jawul nasi goreng swadarma,4.8,45,"Jalan Swadarma Raya, RT.1/RW.8, Ulujami, Pesanggrahan, RT.1/RW.8, Ulujami, Kota Jakarta Selatan",-6.2332933,106.76049779999998,216.0
Pecak Ikan Mas Melati,4.3,50,"Jl. Melati No.11, RT.6/RW.7, Ragunan, Kota Jakarta Selatan",-6.3040500999999995,106.82163059999999,215.0
Nasi Goreng Kambing,4.6,46,"Jl. Duren Tiga Selatan No.31 4 1, RT.4/RW.2, Duren Tiga, Kota Jakarta Selatan",-6.2599275,106.82881809999999,211.6
Nasi Goreng gila ms anto,4.5,47,"nasi goreng gila ms anto, RT.6/RW.3, Ulujami, Kota Jakarta Selatan",-6.2347601,106.7607607,211.5
Nasi Goreng Sejahtera,4.3,49,"Blok, Jl. Sejahtera Blok B26 No.14, East Jurang Manggu, South Tangerang City",-6.264109099999999,106.7368123,210.7
Nasi Goreng Mamake,4.2,50,"Jalan Pemuda # 16 Rt 06 Rw 05 Cipadu, RT.001/RW.008, Kreo Selatan, Kota Tangerang",-6.2395371,106.74033109999999,210.0
Nasi Goreng Dudung,4.6,45,"Jl. Taman Kedaung Raya A No.4, Kedaung, Kota Tangerang Selatan",-6.3176622999999985,106.73995900000001,206.99999999999997
Nasgor Bang Qiting,4.4,46,"Jl. Wadassari 3, Pd. Betung, Kota Tangerang Selatan",-6.266524299999999,106.74670790000002,202.4
NASI GORENG GILA IBU MAY,4.6,44,"Jl. Uranium No.47, RT.1/RW.12, Grogol Utara, Kota Jakarta Selatan",-6.221236900000001,106.79016340000001,202.39999999999998
Restoran Pasta Kangen De Canvas,4.9,41,"Jl. Kebagusan Raya No.42, RW.5, Jagakarsa, Kota Jakarta Selatan",-6.3191728,106.8250254,200.9
Nasi Goreng Nyonya,4.7,42,"Jl. Bangka Raya No.36, RT.2/RW.2, Pela Mampang, Kota Jakarta Selatan",-6.245729700000001,106.8159371,197.4
Nasi Goreng Sarip Ambran,4.2,46,"Jl. Menteng Jaya No.4, RT.12/RW.9, Menteng, Kota Jakarta Pusat",-6.2060547,106.843923,193.20000000000002
Nasi Goreng Lalan,4.6,42,"Jl. Puspa No.13, Kby. Daerah Khusus Ibukota Jkt, RT.11/RW.1, Senayan, Kota Jakarta Selatan",-6.233069400000001,106.8154097,193.2
Qiuliner Resto,4.0,47,"Jl. Hang Lekiu II No.8, RT.8/RW.4, Gunung, Kota Jakarta Selatan",-6.2350485,106.7927596,188.0
Kedai Warisan Eyang - AKRI,4.8,39,"Komplek POLRI Ragunan (AKRI Jalan A No.18, RT.1/RW.6, Ragunan, Kota Jakarta Selatan",-6.2840995,106.82088,187.2
Nasi Goreng 'Mas Makmun' Jaya Abadi,4.5,41,"No., Jl. Pulo Mawar No.79A, RT.1/RW.4, Grogol Utara, Kota Jakarta Selatan",-6.211926000000001,106.78996299999999,184.5
Nasi Goreng Damai 4,4.7,39,"Jl. Damai IV, RT.2/RW.2, Petukangan Sel., Kota Jakarta Selatan",-6.2471352,106.7523091,183.3
Nasi Goreng Si Udin,4.6,39,"Jl. Menteng Wadas Timur No.25, RT.6/RW.2, Ps. Manggis, Kota Jakarta Selatan",-6.2081064,106.8414808,179.39999999999998
Nasi Goreng Pengkolan Cisanggiri III,4.7,38,"Jl. Cisanggiri III No.25, RT.4/RW.4, Petogogan, Kota Jakarta Selatan",-6.2417039,106.81321559999999,178.6
Nasi Goreng Achmad,4.3,41,"Abdul Manaf, Blok Abdul Manaf Jl. H. Manaf No.3, Cempaka Putih, South Tangerang City",-6.297187200000001,106.7602658,176.29999999999998
RAZIK NASGOR,4.1,43,"Jl. Kebagusan II No.1, RT.3/RW.7, Kebagusan, Kota Jakarta Selatan",-6.3060689000000005,106.828805,176.29999999999998
Nasi Goreng Bang Dul,4.3,41,"Jalan Kalisari Raya # 16 Kalisari , Pasar Rebo, Jakarta Timur, RT.2/RW.3, Baru, Kota Jakarta Timur",-6.3300399,106.8525217,176.29999999999998
Nasi GORENG Gila,4.3,41,"No.3, Jl. Ciputat Raya, RT.6/RW.6, Pondok Pinang, South Jakarta City",-6.2716213,106.7754085,176.29999999999998
"Warung Nasi Goreng ""Sedap Malam""",4.5,39,"RW., RT.6/RW.5, Pengadegan, Kota Jakarta Selatan",-6.250179399999999,106.8502033,175.5
NASI GORENG PERDANA,4.7,37,"Jl. Pancoran Barat XI No.18, RT.7/RW.3, Pancoran, Kota Jakarta Selatan",-6.2450731,106.83610130000001,173.9
Nasi Gurih Mamak Ji - Blok S,4.2,41,"Jl. Birah II No.10, RT.6/RW.6, Rw. Bar., Kota Jakarta Selatan",-6.2372440000000005,106.815546,172.20000000000002
Nasgor Slawi Ayu,4.6,36,"Jl. Tebet Dalam 1 No.1, RT.1/RW.1, Tebet Bar., Kota Jakarta Selatan",-6.2243441000000015,106.8477175,165.6
Teras Tebet,4.3,38,"No, Jl. Tebet Timur Dalam IX No.21, RT.7/RW.9, Tebet Tim., Kota Jakarta Selatan",-6.241867999999998,106.856255,163.4
Aneka Nasi Goreng Bhakti,4.3,38,"RT.11/RW.1, West Rawa, South Jakarta City",-6.2331733,106.8151676,163.4
Nasi Goreng Pak Bejo SMA 65,4.8,34,"Jl. Panjang Arteri Klp. Dua Raya No.3, Kb. Jeruk, Kota Jakarta Barat",-6.2005355,106.76736869999999,163.2
Warung Nasi Goreng Ibu Naya,4.4,37,"Depan Masjid Al-Huda Kelurahan Kecamatan Setiabudi, Jalan Pedurenan Masjid 2 rt 09 rw 04, RT.9/RW.4, Karet Kuningan, RT.9/RW.4, Kuningan, Karet Kuningan, Jakarta",-6.2213229000000005,106.8283379,162.8
Nasi Goreng Gila Pondok Berkah,4.5,36,"Jl. Menteng Atas Sel. Gg. 2 No.4, RT.10/RW.4, Menteng Atas, Kota Jakarta Selatan",-6.2176152,106.84029650000001,162.0
NASI GORENG D'JEBREET,4.5,36,"Jl. Limo Raya No.2-9, Limo, Kota Depok",-6.362334400000001,106.77597790000002,162.0
Nasi Goreng Racing,4.7,34,"Jl. Merpati Raya No.5, Sawah Lama, Kota Tangerang Selatan",-6.2953152999999995,106.73486399999999,159.8
Dapurio,4.6,34,"Jl. Kapten Tendean No.43, RT.2/RW.3, Kuningan Bar., Kota Jakarta Selatan",-6.2398042999999985,106.8219986,156.39999999999998
Republic Nasi Goreng,4.2,37,"Jl. Aria Putra Jl. Mampang Prapatan VI No.92, Kedaung, Kota Tangerang Selatan",-6.3157090999999985,106.7350733,155.4
NASI GORENG Mas leman,4.7,33,"007 No. 73 Jl. H. Mursid No.3 RT.4/RW.3, Jagakarsa, RT.4/RW.3, Jagakarsa, Kota Jakarta Selatan",-6.3216081,106.8260084,155.1
Nasi Goreng Ridwan,4.6,33,"Jl. Kemanggisan Pulo No.4, RT.7/RW.17, Palmerah, Kota Jakarta Barat",-6.20193,106.7894112,151.79999999999998
NASI GORENG GILA L.P.B (mas gendut),4.6,33,"Grand centro bintaro, RT.5/RW.3, Kota Jakarta Selatan",-6.2575899,106.75956509999999,151.79999999999998
Nasi Goreng Fahmi Jaya,4.3,35,"Jl. Wijaya Kusuma Ujung IV No.67, RT.9/RW.1, Pd. Betung, Kota Tangerang Selatan",-6.2534725999999985,106.75197379999999,150.5
Gerobak SeGoreng Mas Azam,4.7,32,"RT.8/RW.4, West Cilandak, South Jakarta City",-6.301942700000001,106.79069720000001,150.4
Pondok Nasi Goreng Pakde Komar,4.4,34,"Jl. Seruni Blk. Ca No.2, Sawah Lama, Kota Tangerang Selatan",-6.2961969999999985,106.7412923,149.60000000000002
Nasi Goreng Cak Gendut,4.4,34,"Jl. Kav. Keuangan Raya No.65, Kedaung, Kota Tangerang Selatan",-6.313533899999999,106.7344531,149.60000000000002
Nasi goreng Dadakan Trans jakarta,4.4,34,"Jl. RE Martadinata, Cipayung, Kota Tangerang Selatan",-6.3311229,106.7486693,149.60000000000002
"NASI GORENG POJOK ""MAS HENDI""",4.8,31,"Jl. Surya Kencana No.72, Pamulang Bar., Kota Tangerang Selatan",-6.358669799999999,106.73349089999999,148.79999999999998
"Nasi Goreng ""Mas Ali""",4.5,33,"Jl. H. Lele, RT.6/RW.7, Srengseng Sawah, Kota Jakarta Selatan",-6.352272,106.81555790000002,148.5
nasi goreng panorama jaelani,4.5,33,"sebrang salon juju, Jl. Moh. Kahfi 1 No.67, RT.7/RW.4, Jagakarsa, Kota Jakarta Selatan",-6.3264333,106.8111517,148.5
Nasi Goreng GunungKidul,4.6,32,"Jl. Cipete Raya No.35-36, RT.9/RW.4, Cipete Sel., Kota Jakarta Selatan",-6.2780948,106.807069,147.2
Nasi Goreng Gondang Mas,4.7,31,"Jl. Rawa Simprug I No.30, RT.8/RW.10, Grogol Sel., Kota Jakarta Selatan",-6.227398300000001,106.78367379999999,145.70000000000002
Nasi Goreng Mas Baim,4.4,33,"Jalan Raya Condet. no.02 RT 05 RW 15 Cililitan Kramat Jati, RT.8/RW.5, Cililitan, DKI Jakarta",-6.265558,106.861276,145.20000000000002
Nasi Goreng Prapatan,4.5,32,"Jalan Kh Tohir Rt 03 Rw 07 # 27 A, Sukabumi Selatan, Kebon Jeruk, RT.3/RW.7, Sukabumi Sel., Kota Jakarta Barat",-6.2240269999999995,106.767997,144.0
Nasi Goreng Gaul,4.7,30,"Jl. Simprug Golf 2 No.1, RT.10/RW.8, Grogol Sel., Kota Jakarta Selatan",-6.2280478,106.7940622,141.0
Nasi Goreng Pak Mo,4.4,32,"Jl. Menjangan III, Pd. Ranji, Kota Tangerang Selatan",-6.2877367,106.73909850000001,140.8
Cah Pemalang Fried Rice,4.8,29,"Ps., Cisalak Ps., Kota Depok",-6.3725989,106.86635159999999,139.2
NASGOR MUNCUL MALAM,4.2,33,"Jl Ciledug Raya gang H Gaim No 25A Rt 01 Rw 02 Petukangan Utara Pesanggrahan, RT.1/RW.2, Petukangan Utara, Kota Jakarta Selatan",-6.233826700000002,106.7487929,138.6
Nasi Goreng 66 NamNampoolll...,4.6,30,"Jl. Pepaya Raya No.46, RT.7/RW.5, Jagakarsa, Kota Jakarta Selatan",-6.3182944,106.81886770000001,138.0
Warung Pakde Sarginen,4.6,30,"Jalan Bangka Raya Gg Amal 1 RT.8/RW.5 No.7, RT.8/RW.5, Pela Mampang, Kota Jakarta Selatan",-6.2435760999999985,106.8149548,138.0
Nasi Goreng Bang Roy Fae,4.6,30,"Jl. H. Sulaiman No.67, RT.3/RW.1, Petukangan Utara, Kota Jakarta Selatan",-6.2342152,106.745609,138.0
Nasi goreng beringin,4.7,29,"Jl. Senayan No.73, RT.8, Rw. Bar., Kota Jakarta Selatan",-6.236771999999998,106.816854,136.3
Nasi Goreng Pak Kardi,4.5,30,"Jl. Masjid Al-Ikhlas No.122, Pd. Betung, Kota Tangerang Selatan",-6.2561008000000005,106.75191070000001,135.0
Nasi Goreng Udin,4.5,30,"Jl. Pekayon No.2, RT.1/RW.3, Ragunan, Kota Jakarta Selatan",-6.2816224,106.8246895,135.0
Nasi Goreng Gila Mas Topan,4.2,32,"Jl. Swadarma Raya No.55, RT.7/RW.3, Srengseng, Kota Jakarta Barat",-6.2209703,106.7603101,134.4
Nasi Goreng GONZALES,4.2,32,"RW, RT.9/RW.7, Lb. Bulus, Kota Jakarta Selatan",-6.2908504,106.77757849999999,134.4
Nasi goreng gila MASDAN,4.3,31,"Jl. H. Jian No.3, RT.6/RW.3, Cipete Utara, Kota Jakarta Selatan",-6.258921,106.80647900000001,133.29999999999998
Nasi Goreng Classica 2,4.4,30,"Jl. Kalibata Utara II No.13, RT.3/RW.2, Kalibata, Kota Jakarta Selatan",-6.2600172,106.8422479,132.0
Nasi Goreng Classica 1,4.7,28,"Jl. Bangka V No.40, RT.12/RW.3, Pela Mampang, Kota Jakarta Selatan",-6.2478107000000005,106.81599109999999,131.6
Nasi Goreng Pakde Blangkon,5.0,26,"Jl. Naman Iskandar No.90, Limo, Kota Depok",-6.360150599999999,106.7804146,130.0
Nasi Goreng Betawi Pak Dedi,4.4,29,"Jl. Menteng Jaya No.1, RT.8/RW.8, Menteng, Kota Jakarta Pusat",-6.2068884,106.84626680000001,127.60000000000001
Nasi Goreng Ano,4.4,29,"Jl. H. Ridi No.24-96, RT.2/RW.3, Ulujami, Kota Jakarta Selatan",-6.235856999999998,106.76351899999999,127.60000000000001
Nasi Goreng Kambing Bang Arifin Cabang Kebon Sirih,4.5,28,"Jl. Duren Tiga Raya, RT.6/RW.4, Duren Tiga, Kota Jakarta Selatan",-6.261571699999998,106.8432196,126.0
Nasi Goreng Sahabat Malam,4.5,28,"Jl. Bintaro Permai II No.2, RT.2/RW.9, Bintaro, Kota Jakarta Selatan",-6.2575736000000015,106.76427240000001,126.0
Nasi Goreng MAMA Tegal,4.8,26,"Jl. Teratai Putih No.110, Rengas, Kota Tangerang Selatan",-6.279136900000001,106.75533259999999,124.8
Nasi Goreng Medan Mami Timah,4.7,26,"Haji Mizi, Blok Haji Mizi, Gg. H.M.Izi No.74A, RT.8/RW.5, Cililitan, East Jakarta City",-6.265921499999999,106.86265039999999,122.2
Nasi Goreng Pohon asem,4.2,29,"No, Jl. Perintis No.32, RT.7/RW.2, Kuningan, Karet Kuningan, Kota Jakarta Selatan",-6.2141651,106.8231491,121.80000000000001
Nasi Goreng Saipul,4.5,27,"Jl. Langgar No.81, RT.7/RW.6, Tj. Bar., Kota Jakarta Selatan",-6.3112572999999985,106.84651159999999,121.5
Nasi Goreng Slamet,4.3,28,"Jl. Taman Bukit Kemang, RT.8/RW.7, Cipete Utara, Kota Jakarta Selatan",-6.2658925000000005,106.8119939,120.39999999999999
Warbes Win,4.8,25,"Jl. Raya Bogor No.26, RT.1/RW.1, Cililitan, Kota Jakarta Timur",-6.264526900000001,106.86567340000002,120.0
Nasi Goreng Mledak,4.8,25,"Jl. Bri Radio Dalam No.3, RT.1/RW.15, Gandaria Utara, Kota Jakarta Selatan",-6.2571866,106.78897749999999,120.0
