Name,Rating,NumberOfUser,Address,lat,lon,X
Nasi Cikur EndoooLLL,5.0,1,"Jl. Punak No.12, Pangkalan Jati, Kota Depok",-6.3213789999999985,106.784701,5.0
Nasi Goreng 99,5.0,1,"Mal Cinere Depok, Jl. Cinere Raya, Pangkalan Jati, Kota Depok",-6.3240940000000005,106.783859,5.0
Nasi Goreng Padang Gunuang Sejati,5.0,1,"Jl. Kyai H. Syahdan No.4E, RT.2/RW.11, Palmerah, Kota Jakarta Barat",-6.2013228,106.7879767,5.0
"nasi goreng ""sandekala mas fay""rawakalong",5.0,1,"Jl. Rawakalong No.17, Grogol, Kota Depok",-6.374103599999999,106.7953395,5.0
Nasi Goreng Kebuli Blok M,5.0,1,"Blok M Square Lantai Basement Blok F no 023 V Kebayoran Baru, Jl. Melawai Raya, RT.3/RW.1, Melawai, DKI Jakarta",-6.244337000000001,106.80116899999999,5.0
Nasi Goreng Udin,5.0,1,"Jl. Kebagusan Raya No.3A, RT.10/RW.5, Jagakarsa, Kota Jakarta Selatan",-6.3181867999999985,106.8249213,5.0
Bang Mamad Nasi Goreng,5.0,1,"Gg. Al-Barkah No.24-31, RT.11/RW.9, Pekayon, Kota Jakarta Timur",-6.345198099999998,106.8610726,5.0
Nasi Goreng Kabul,5.0,1,"Jl. Raya Lapan No.1, RT.13, RT.13/RW.1, Pekayon, Kota Jakarta Timur",-6.34162,106.8595327,5.0
Nasi Goreng Lumayan,5.0,1,"Jl. Durian, RT.4/RW.4, Jagakarsa, Kota Jakarta Selatan",-6.3194365999999995,106.814481,5.0
Nasi Goreng Bomi Boy,5.0,1,"Jl. Tipar, RT.9/RW.7, Mekarsari, Kota Depok",-6.3538974,106.86903170000001,5.0
Nasi Goreng MaxSinta,5.0,1,"Pulo Melati 6 No.15, RT.3/RW.16, Grogol Utara, Kota Jakarta Selatan",-6.2120431,106.79132079999998,5.0
Nasi Goreng Khasna Ilmi,5.0,1,"Jl. Ceger Raya No.5, Jurang Manggu Tim., Kota Tangerang Selatan",-6.2623354,106.73318470000001,5.0
Nasi Goreng Special Jurang Manggu,5.0,1,"West Jurang Manggu, South Tangerang City",-6.2625221,106.7302908,5.0
nasi goreng bang malam bangka 9,5.0,1,"Jl. Bangka IX Jl. Kemang Raya, RT.13/RW.1, Bangka, Kota Jakarta Selatan",-6.2551906,106.814632,5.0
Nasi Goreng Mas Adi,5.0,1,"RT.9/RW.10, Pela Mampang, Kota Jakarta Selatan",-6.2532009,106.82253329999999,5.0
Nasi Goreng Gondrong 45,5.0,1,"RT.11/RW.7, Menteng, Central Jakarta City",-6.2038883,106.8366662,5.0
Nasi Goreng Pakde Rinto,5.0,1,"Jl. Kemang Dalam XIBlok F RT.5, RT.5/RW.3, Bangka, Kota Jakarta Selatan",-6.2664263999999985,106.81971770000001,5.0
NASI GORENG ORTEGA,5.0,1,"Jl. Kuningan Madya, RT.1/RW.6, Guntur, Kota Jakarta Selatan",-6.210609499999999,106.83084509999999,5.0
Nasi goreng bang Juki,5.0,1,"Jl. Tol Jkt - Serpong, RT.10/RW.8, Pesanggrahan, Kota Jakarta Selatan, Daerah Khusus Ibukota Jakarta, RT.3/RW.8, Pesanggrahan, Kota Jakarta Selatan",-6.2632933,106.7567163,5.0
Nasi Goreng Mas Budi,5.0,1,"Jl. Depsos Raya No.3, RW.1, Bintaro, Kota Jakarta Selatan",-6.2636778999999985,106.76551629999999,5.0
Warung Nasi Goreng Asifa,5.0,1,"Jl. H. Taip, RT.4/RW.9, Kedaung, Kota Tangerang Selatan",-6.3179586,106.73641229999998,5.0
Nasi Goreng Wijaya 2,5.0,1,"RT.2/RW.1, Pulo, South Jakarta City",-6.2531083,106.7978865,5.0
Nasi Goreng Manggut,5.0,1,"Jl. Manggarai Utara VI No.6, RT.8/RW.1, Manggarai, Kota Jakarta Selatan",-6.211965699999999,106.8532148,5.0
Nasi Goreng Mat Soleh,5.0,1,"Jl. RA. Fadillah No.17, RT.1/RW.6, Baru, Kota Jakarta Timur",-6.3276197,106.8447581,5.0
Nasi Goreng Radas Kemang,5.0,1,"Jl. Kemang I No.6A, RT.11/RW.1, Bangka, Kota Jakarta Selatan",-6.2558715,106.8123275,5.0
Nasi Goreng Pondok Pinang,5.0,1,"Jl. Ciputat Raya No.10, RT.1/RW.2, Pd. Pinang, Kota Jakarta Selatan",-6.261825,106.775299,5.0
Nasi Goreng Kambing Khas Kebon Sirih,5.0,1,"No Pamulang, Jl. Kav. Keuangan Raya No.100, Kedaung, Kota Tangerang Selatan",-6.310594999999998,106.734175,5.0
NASI GORENG SI IBU,5.0,1,"Jl. Apel, RT.1/RW.13, Srengseng Sawah, Kota Jakarta Selatan",-6.3407946,106.8308277,5.0
Nasi Goreng Bank Roy,5.0,1,"Jalan Doktor Setia Budi, Pamulang, Pamulang Tim., Kota Tangerang Selatan",-6.347538,106.748938,5.0
"Warung Pisang Goreng Kepok Dan Tanduk ""Mang Cacan""",2.5,2,"depan smk karya guna, RT.15/RW.4, Manggarai, Kota Jakarta Selatan",-6.2112468000000005,106.8515608,5.0
"Nasi Goreng Harto Paul, Haji Raya",5.0,1,"Jl. H. Raya No.11 B, RT.5/RW.10, Gandaria Utara, Kota Jakarta Selatan",-6.261951199999999,106.7910564,5.0
Bandar Nasgor,5.0,1,"Jl. Kemang Raya No.10, RT.4/RW.1, Bangka, Kota Jakarta Selatan",-6.2570700000000015,106.81511840000002,5.0
Nasi Goreng Bolot,5.0,1,"RT.6/RW.4, Menteng, Central Jakarta City",-6.2015191,106.83301499999999,5.0
nasi goreng bang ali,5.0,1,"didepan pangkas rambut gaul, Jl. Asem II No.80, RT.1/RW.3, Cipete Sel., Kota Jakarta Selatan",-6.272536700000002,106.8057392,5.0
Nasi goreng Alfin,5.0,1,"Jl. Kona 1 No.51, Cinangka, Kota Depok",-6.367515,106.75718,5.0
Nasi Goreng Encoy,5.0,1,"Jl. Pancoran Barat VII No.8, RT.8/RW.6, Duren Tiga, South Jakarta City",-6.252302200000001,106.8375808,5.0
Nasi Goreng Dan Chinese Food Wonogiri 99,5.0,1,"Taman Singkarak, Jl. Bendungan Hilir No.11, RT.5/RW.3, Bend. Hilir, Kota Jakarta Pusat",-6.2110447,106.8123571,5.0
Nasi goreng oJi icikiwir,5.0,1,"Jl. Raya Cirendeu No.7, Cireundeu, Kota Tangerang Selatan",-6.3133903,106.7699908,5.0
Nasi Goreng Mas NAWIR,5.0,1,"Jl RA Fadillah Depan BRI KOPASSUS RT.04/RW.07 Baru Kecamatan Pasar Rebo, RT.2/RW.7, Cijantung, Kota Jakarta Timur",-6.3245575,106.84556200000002,5.0
Nasi Nyarap,5.0,1,"Jl. Sejahtera No.7, Jurang Manggu Tim., Kota Tangerang Selatan",-6.2653805,106.736902,5.0
Nasi Goreng Bungsu Jaya,5.0,1,"Gang Kiesun No. 07, Pekayon, Pasar Rebo, RT.10/RW.5, Pekayon, Kota Jakarta Timur",-6.3531084,106.868505,5.0
Nasi Goreng Opik....,5.0,1,"Jl. Raya Bogor No.7, RT.6/RW.2, Pekayon, Kota Jakarta Timur",-6.348830299999999,106.8660426,5.0
Nasi Goreng Pekalongan Pak Yogo,5.0,1,"RT.1/RW.1, West Pejaten, South Jakarta City",-6.266366400000001,106.8443085,5.0
Nasi Goreng & Mie Goreng SURABAYA,5.0,1,"Jl. Al-Hidayah No.32-38, RT.9/RW.9, Cawang, Kota Jakarta Timur",-6.2555632,106.8673091,5.0
NASI GORENG D'JEBREET,5.0,1,"DURA QUIP CEMERLANG, Jalan Limo Raya nomor 9 Limo Limo Depan PT, Meruyung, Kota Depok",-6.3724029999999985,106.7719709,5.0
Nasi Goreng Babat & Bakmi Jogja,5.0,1,"Food Station Kalibata Plaza Lantai Ground #, Jl. Raya Kalibata No.1, RT.3/RW.2, Rawajati, Kota Jakarta Selatan",-6.257529,106.85624399999999,5.0
Nasi goreng sumber rejeki,5.0,1,"Gandul, Depok City",-6.340064099999998,106.79333079999999,5.0
Nasi Goreng Kambing 57 Nurul Nazifa,5.0,1,"Jl. Raya No.62, RT.2/RW.4, Pd. Petir, Kota Depok",-6.3676096,106.7309068,5.0
Nasi Goreng Jomblo,5.0,1,"Jl. Legoso Raya No.37-42, Pisangan, Kota Tangerang Selatan",-6.3137826,106.7543368,5.0
Nasi Goreng Cahciremeng,5.0,1,"Jl. Duren Tiga Selatan No.36, RT.1/RW.2, Kalibata, Kota Jakarta Selatan",-6.2586664,106.84194280000001,5.0
Nasi Kepal Dapur Mama Thia,5.0,1,"Jl. Tarumanegara No.37, RW.2, Pisangan, Kota Tangerang Selatan",-6.3145286999999986,106.75672970000001,5.0
Nasi goreng mas anas,5.0,1,"Legoso raya, Jl. Legoso Raya, Pisangan, Kota Tangerang Selatan",-6.3215925,106.7553182,5.0
Nasi goreng pakde djon,5.0,1,"Jl. Moh. Kahfi 1 Blok Cermai No.58, RT.1/RW.4, Jagakarsa, Kota Jakarta Selatan",-6.324451199999999,106.81138700000001,5.0
Nasi Goreng Jangkung,2.5,2,"Jl. Benda No.20, RT.6/RW.4, Cilandak Tim., Kota Jakarta Selatan",-6.2757865,106.81580759999999,5.0
Nasi Goreng Omelet,5.0,1,"M Jagakarsa, Jalan Kahfi No.1, RT.6/RW.2, Cipedak, DKI Jakarta",-6.363257,106.802043,5.0
Nasi Goreng - Mas Gondrong -,2.5,2,"No., Jl. Palatehan II No.44, RT.1/RW.1, Melawai, Kota Jakarta Selatan",-6.2410194,106.80189540000002,5.0
Nasi Bakar Budhe Djadi,5.0,1,"Rengas, South Tangerang City",-6.2781829999999985,106.75211100000001,5.0
nasi goreng (bang Roni),5.0,1,"blok A 32, Jl. Gudang Peluru Raya No.2, RT.1/RW.1, Kb. Baru, Kota Jakarta Selatan",-6.2259471,106.8619906,5.0
Nasi Goreng Bang Wahab,5.0,1,"Jl. Buntu Raya, Cireundeu, Kota Tangerang Selatan",-6.299189399999999,106.76468440000001,5.0
Nasi Goreng Kedai biru,5.0,1,"Jl. Ir H. Juanda No.63, RT.4/RW.1, Rempoa, Kota Tangerang Selatan",-6.2960818,106.7653111,5.0
Nasi Goreng Aziz,5.0,1,"Jl. Swadaya No.3 RT.11/RW.10, RT.10/RW.9, Pejaten Tim., Kota Jakarta Selatan",-6.288569499999999,106.8468861,5.0
Nasi Goreng Kambing Sedap Malam Alfa Indah Mas Agung,5.0,1,"Jl. Joglo Raya, RT.12/RW.3, Joglo, Kota Jakarta Barat",-6.2182945,106.75404280000001,5.0
Nasi Goreng Baim,5.0,1,"Jl. Raden Patah No.10, RT.2/RW.1, Selong, Kota Jakarta Selatan",-6.2373362,106.79967749999999,5.0
Nasi goreng bejo,5.0,1,"Jl. Palangkaraya, Tugu, Kota Depok",-6.368556099999998,106.8544352,5.0
NASGOR BHOCOR BANG KUMIS,5.0,1,"Rengas, South Tangerang City",-6.281860699999998,106.7466935,5.0
Nasi Goreng Shandekala,5.0,1,"Jl. Ki Hajar Dewantara No.4, Sawah Lama, Kota Tangerang Selatan",-6.301419,106.740602,5.0
Nasi Goreng Slawi Ayu,5.0,1,"Jl. W R Supratman No.44 D, Cemp. Putih, Kota Tangerang Selatan",-6.2823129999999985,106.74626940000002,5.0
Nasi Goreng Bang Slawi,5.0,1,"Jl. Bintaro Tengah No.7, Rengas, Kota Tangerang Selatan",-6.27705,106.75283799999998,5.0
Nasi Goreng Ramadan,5.0,1,"Jl. Kostrad Pusri No.2-17, RT.9/RW.4, Petukangan Utara, Kota Jakarta Selatan",-6.2337063,106.7572007,5.0
Nasi Goreng Kambing Bang Subur,5.0,1,"Mesjid Almubarok, RT.1/RW.11, Cipulir, Kby. Lama, Kota Jakarta Selatan, Daerah Khusus Ibukota Jakarta, RT.1/RW.11, Cipulir, Kota Jakarta Selatan",-6.239390900000001,106.7717068,5.0
Nasi Goreng Pak Lawung,5.0,1,"Jl. Ki Hajar Dewantara No.101, Sawah Lama, Kota Tangerang Selatan",-6.297118599999999,106.73762260000001,5.0
Nasi Goreng Bang DOEL,5.0,1,"RT.2/RW.8, Ulujami, South Jakarta City",-6.2327324,106.7598571,5.0
Nasi Goreng Bunga Mawar,5.0,1,"Jl. Raya Gandul, Gandul, Kota Depok",-6.3389790999999995,106.793899,5.0
Nasi Goreng Polda,5.0,1,"RT.5/RW.3, Senayan, South Jakarta City",-6.2224865,106.81400249999999,5.0
Nasi Goreng Wong Brebes,5.0,1,"RT.8/RW.3, Ulujami, South Jakarta City",-6.2331002999999985,106.7607433,5.0
Nasi Goreng Pengkolan,5.0,1,"Jl. Bahari I, RT.9/RW.7, Gandaria Sel., Kota Jakarta Selatan",-6.2784631,106.79340230000001,5.0
Nasi Goreng Rosikin,5.0,1,"Jl. Otista Raya No.5G, Ciputat, Kota Tangerang Selatan",-6.325029400000001,106.74513540000001,5.0
Tenda Kevin Cool 2,5.0,1,"Jl. Anggrek VII No.11, RW.2, Kuningan, Karet Kuningan, Kota Jakarta Selatan",-6.217269,106.8267567,5.0
Nasi Goreng Bang Udin,2.5,2,"Ciputat, South Tangerang City",-6.3110081,106.74591129999999,5.0
Nasi Goreng Bintang,5.0,1,"Jl. Surya Kencana, Pamulang Bar., Kota Tangerang Selatan",-6.3598694,106.73269609999998,5.0
Mpekmpek_Jakarta,5.0,1,"Jl. Bukit Duri Tanjakan No.24A, RT.1/RW.9, Bukit Duri, Kota Jakarta Selatan",-6.223593599999999,106.8591787,5.0
"Nasi Goreng ""Salim""",5.0,1,"East Pamulang, South Tangerang City",-6.357038699999999,106.7457236,5.0
Nasi Goreng Berkah Jaya,5.0,1,"RT.1/RW.3, Mampang Prapatan, South Jakarta City",-6.2402811,106.82640239999999,5.0
Radja Nasi Goreng 2,5.0,1,"Jl. Yaktapena Raya, Pd. Ranji, Kota Tangerang Selatan",-6.2862934,106.74166770000001,5.0
Nasi Goreng Samping Indomart,5.0,1,"Jl. Panjang Cidodol No.9, RT.5/RW.13, Grogol Sel., Kota Jakarta Selatan",-6.230014700000001,106.77177179999998,5.0
Nasi Goreng Mutiara,5.0,1,"Jl. Pahlawan No.79-81, Rempoa, Kota Tangerang Selatan",-6.288114999999999,106.7596727,5.0
Nasi Goreng & Seafood Selera Rasa,5.0,1,"Jl. Raya Tengah No.4 B, RT.5/RW.12, Gedong, Kota Jakarta Timur",-6.298081,106.86121599999998,5.0
NASI GORENG MURAH SENYUM,5.0,1,"Jl. Raya Tengah No.88, RT.2/RW.3, Gedong, Kota Jakarta Timur",-6.295126,106.86109609999998,5.0
nasi goreng tiga putra,5.0,1,"Jl. RA. Fadillah, Kalisari, Kota Jakarta Timur",-6.3368725,106.8443051,5.0
Tenda Nasi Goreng,5.0,1,"Jl. Kalisari II No.1, RT.1/RW.2, Kalisari, Kota Jakarta Timur",-6.3387012,106.85463130000001,5.0
Nasi Goreng Sedap Malam,5.0,1,"Jl. Nangka Raya, RT.4/RW.5, Tj. Bar., Kota Jakarta Selatan",-6.3022776,106.85002820000001,5.0
NASI GORENG PETER DAN MIESO PAK TRI SOLO,5.0,1,"Jl. Nimun Raya No.10 -24, RT.4/RW.10, Kby. Lama Sel., Kota Jakarta Selatan",-6.2288218,106.7786604,5.0
Nasi Goreng Kambing H.A Bachtiar,5.0,1,"Jl. Hang Lekir No.10, RT.9/RW.6, Gunung, Kota Jakarta Selatan",-6.2300049999999985,106.795978,5.0
NASI GORENG PAK SLAMET,5.0,1,"Jl. Limo Raya No.2, Limo, Kota Depok",-6.365999400000001,106.77499170000002,5.0
NASI GORENG CAFE SENDEKALA 84,5.0,1,"Jl. K.H.M. Usman No.74, Kukusan, Kota Depok",-6.3632944999999985,106.81554890000001,5.0
Nasi Encim,5.0,1,"RT.5/RW.1, Kuningan, Kuningan Tim., Kota Jakarta Selatan",-6.227499900000001,106.82387250000001,5.0
Yayu,5.0,1,"Jl. Raya Meruyung No.85, Limo, Kota Depok",-6.3598715,106.7757889,5.0
Nasi goreng gila menteng,5.0,1,"Jl. Pala Raya, RT.02/RW01, Pd. Cabe Udik, Kota Depok",-6.3581786,106.7642207,5.0
Rumah Makan Surbaya 'Cak Ganto',5.0,1,"Jl. Jeruk Purut No.19, RT.1/RW.2, Cilandak Tim., Kota Jakarta Selatan",-6.2905989999999985,106.81294799999999,5.0
Nasi Goreng Sendekala,5.0,1,"Jl. Moch. Kahfi II No.4, RT.8/RW.1, Jagakarsa, Kota Jakarta Selatan",-6.335510500000001,106.8281553,5.0
Nasi Goreng,5.0,1,"Jl. Jeruk Raya No.31A, RT.12/RW.1, Jagakarsa, Kota Jakarta Selatan",-6.3330714000000015,106.82815500000001,5.0
Rm Nasi Mawaddam,5.0,1,"Jl. Musyawarah, RT.8/RW.1, Ragunan, Kota Jakarta Selatan",-6.2884837,106.82270749999999,5.0
Nasi Goreng Mas Dar (Tegal),5.0,1,"Jl. Raya Ragunan, RT.5/RW.5, Jati Padang, Kota Jakarta Selatan",-6.286199400000001,106.8274568,5.0
Nasi Goreng Kebuli Mataram,5.0,1,"Jl. Palbatu 2 No, RT.13/RW.4, Menteng Dalam, South Jakarta City",-6.2259745,106.84483290000001,5.0
Nasi goreng bang BONTOT,5.0,1,"No, Jl. Cengkeh No.7A, Pondok Cina, Kota Depok",-6.3648405,106.8328208,5.0
Nasi Goreng kembar,5.0,1,"Kelapa Muda, RT.3/RW.3, Jagakarsa, Kota Jakarta Selatan",-6.3225735,106.8276379,5.0
Nasi Goreng Surabaya,5.0,1,"Jalan Masjid Darul Falah No.16G, RT.12/RW.3, Petukangan Utara, Pesanggrahan, RT.4/RW.2, Petukangan Utara, Kota Jakarta Selatan",-6.2332540000000005,106.75132350000001,5.0
Nasi Goreng Rawit Cabang Jalan Daksa II,5.0,1,"Jalan RC. Veteran Raya No.8D, Pesanggrahan, RT.3/RW.7, Bintaro, Kota Jakarta Selatan",-6.2766934,106.7626258,5.0
Nasgor Kadek,5.0,1,"Jl. Cimandiri V, Cipayung, Kota Tangerang Selatan",-6.3337821,106.7547274,5.0
"Nasi Goreng ""Wong Sampiran""",5.0,1,"Jl. H. Radin No.3, RT.14/RW.3, Petukangan Utara, Kota Jakarta Selatan",-6.235117099999999,106.7542362,5.0
Warung Nasi Goreng,5.0,1,"8 5, RT.8/RW.5, Mampang Prpt., Kota Jakarta Selatan",-6.2452347999999995,106.8296616,5.0
Toge Goreng Dan Laksa Mpo Maya,5.0,1,"Jl. Palakali Blok Sailun No.39, Kukusan, Kota Depok",-6.3691239999999985,106.816492,5.0
Nasi Goreng Akrie,5.0,1,"RT.11/RW.11, Bintaro, South Jakarta City",-6.2743305,106.7550027,5.0
Nasi goreng Fajar jaya,5.0,1,"Jl. Musyawarah No.7, RT.14/RW.2, Kb. Jeruk, Kota Jakarta Barat",-6.200755,106.77389720000001,5.0
Nasi Kebuli Daging Sapi UG (Ujang Gabruk),5.0,1,"Jl. Cimandiri VI, Cipayung, Kota Tangerang Selatan",-6.331924,106.75478570000001,5.0
Nasi Goreng Mas Parno,5.0,1,"Jl. Raya Cirendeu No.26-24, Pisangan, Kota Tangerang Selatan",-6.3223319,106.76773440000001,5.0
Nasi Goreng 016,5.0,1,"Jl. Pajajaran, Pamulang Bar., Kota Tangerang Selatan",-6.336821400000001,106.7387565,5.0
Nasi Goreng Klengerr,5.0,1,"Jl. Kertamukti No.8, Pisangan, Kota Tangerang Selatan",-6.3072180000000015,106.7592372,5.0
Nasi goreng Misbar - Bang Roni,5.0,1,"Jl. Kertamukti No.1, RT.4/RW.17, Pisangan, Kota Tangerang Selatan",-6.311332699999999,106.75865859999999,5.0
Nasi Bakar Rendang,5.0,1,"Rafel's Kampung Makan, Jl. Meruya Selatan, RT.4/RW.4, North Meruya, West Jakarta City",-6.2011821,106.740448,5.0
Nasi Goreng Gila Bang Teguh,5.0,1,"Jl. Curug Agung, Krukut, Kota Depok",-6.3645703000000005,106.79292240000002,5.0
Nasi Goreng Kambing,5.0,1,"West Pamulang, South Tangerang City",-6.3487642,106.7373437,5.0
Nasi Goreng Ortega,5.0,1,"RT.10/RW.2, Pondok Pinang, South Jakarta City",-6.269949400000001,106.7752564,5.0
Nasi Goreng Kambing Wong Tegal,5.0,1,"Jl. Madrasah I No.2A, RT.7/RW.9, Sukabumi Utara, Kota Jakarta Barat",-6.2137138,106.77492240000002,5.0
NASI GORENG OH LALA,5.0,1,"Limo, Depok City",-6.3539843000000005,106.77606440000001,5.0
Nasi Goreng Hendra,5.0,1,"Gg. V No.9, RT.2/RW.2, Pela Mampang, Kota Jakarta Selatan",-6.244906599999998,106.8163164,5.0
Nasi Goreng Si Bedul,5.0,1,"Jl. Srengseng Sawah No.22, RT.9/RW.9, Srengseng Sawah, Kota Jakarta Selatan",-6.357500900000002,106.8103112,5.0
NASI GORENG SPESIAL,5.0,1,"No Ciputat, Jl. Bhakti No.24, Ciputat, Kota Tangerang Selatan",-6.308856599999999,106.74478880000001,5.0
Pisang Goreng Crispy Ny. Huang,5.0,1,"Nomer, Jl. U No.25A, RT.7/RW.12, RT.8/RW.15, Palmerah, West Jakarta City",-6.202430400000001,106.78328859999999,5.0
Cahaya Nasi Goreng 58 Flamboyan,5.0,1,"Jl. Bunga Flamboyan No.4, RT.6/RW.2, Cipete Sel., Kota Jakarta Selatan",-6.2701183999999985,106.8034237,5.0
Nasi goreng Pakde,5.0,1,"Jl batu ampar V rt13 rw05, RT.4/RW.5, Batu Ampar, Kota Jakarta Timur",-6.2775856,106.8652378,5.0
Nasi Goreng & Mie Ayam BM,5.0,1,"Jalan Tarumanegara, Pisangan, Kota Tangerang Selatan",-6.3234615,106.76406680000001,5.0
nasi goreng super,5.0,1,"Jl. Margonda Raya No.88, Kemiri Muka, Kota Depok",-6.374594,106.83271840000002,5.0
Nasi Goreng Spesial NGSP,5.0,1,"RT.4/RW.4, Bukit Duri, South Jakarta City",-6.221057599999999,106.8545304,5.0
NASI GORENG YAPORAHA,5.0,1,"Jl. Talas III, Pd. Cabe Ilir, Kota Tangerang Selatan",-6.3351296999999995,106.760756,5.0
Nasi goreng Barokah,5.0,1,"Jl. Pesantren No.41, RT.002/RW.003, Kreo Selatan, Kota Tangerang",-6.238992,106.74333100000001,5.0
Nasi Goreng Spesial+Seafood,5.0,1,"Cipayung, South Tangerang City",-6.3241057000000005,106.74687959999999,5.0
Nasi Goreng EDO,5.0,1,"Jl. Raya Cilandak Kko No.9-10, RT.1/RW.7, Cilandak Tim., Kota Jakarta Selatan",-6.3102852,106.81361869999999,5.0
nasi goreng mas rino,5.0,1,"Jl. Chairil Anwar, RT.004/RW.001, Kreo, Kota Tangerang",-6.2323564000000005,106.73760520000002,5.0
Nasi goreng madura,5.0,1,"perempatan indomaret, Jl. Menteng Atas, RT.8/RW.12, Menteng Atas, Kota Jakarta Selatan",-6.2140683,106.8406365,5.0
NASI GORENG IMAN TEA,5.0,1,"Jl. Bahagia No.36, RT.006/RW.001, Cipadu, Kota Tangerang",-6.236288,106.73528,5.0
Nasi Goreng Kebuli Bang Yudi,5.0,1,"Ruko Nurul Fikri No.RT 07/012, Tugu, Kota Depok",-6.3621232,106.8490741,5.0
Nasi Goreng Pak Kumis,5.0,1,"RT.1/RW.5, Jati Padang, South Jakarta City",-6.281580399999998,106.82943229999998,5.0
NASI GORENG SNI Bang Bogel,5.0,1,"Jl. Ampera Raya No.8-2, RT.1/RW.6, Ragunan, Kota Jakarta Selatan",-6.283657,106.81911480000001,5.0
Nasi Goreng Petarukan Bang Yus,5.0,1,"Jl. H. Najih No.51, RT.003/RW.006, Kreo Selatan, Kota Tangerang",-6.236794600000001,106.7414689,5.0
Taichan Goreng Kelapa Dua,5.0,1,"Tugu, Depok City",-6.359996,106.8431437,5.0
ANZA Waroeng Nasi Goreng,5.0,1,"Jl. Kober No.11-17, Pondok Cina, Kota Depok",-6.3607683,106.8349385,5.0
Nasi goreng gila paten,5.0,1,"Jl. Pengadegan Utara No.5, RT.7/RW.7, Pengadegan, Kota Jakarta Selatan",-6.246393599999998,106.8555597,5.0
Nasi Goreng PORTUGAL,2.5,2,"Jl. Pd. Labu Raya, RT.6/RW.1, Pd. Labu, Kota Jakarta Selatan",-6.3123923,106.79344170000002,5.0
Warung Nasi goreng Sp Bangjoy Samping Unas,5.0,1,"RT.2/RW.10, Jati Padang, South Jakarta City",-6.280545,106.83737920000002,5.0
Nasi Goreng Ojo Lali,4.0,1,"Jl. Garuda No.2b, Pasir Gn. Sel., Kota Depok",-6.3440867999999995,106.849299,4.0
Ketoprak,4.0,1,"Jl. Raya Meruyung, Limo, Kota Depok",-6.3646379,106.77539490000001,4.0
Nasi Goreng Gila Bang Safa,4.0,1,"Jl. Pepaya Raya No.3, RT.2/RW.5, Jagakarsa, Kota Jakarta Selatan",-6.3250987,106.8198172,4.0
Nasi Goreng Wow,4.0,1,"Jl. Surya Kencana No.83A, Pamulang Bar., Kota Tangerang Selatan",-6.3507365999999985,106.7342932,4.0
Nasi Goreng Tombo Kangen Ibnu Armah,4.0,1,"Jl. Ibnu Armah No.18, Pangkalan Jati Baru, Kota Depok",-6.3284477,106.7995136,4.0
Nasi Goreng Arwie Bahari,4.0,1,"Jl. Kalisari Raya No.68, RT.2/RW.3, Kalisari, Kota Jakarta Timur",-6.3320162999999985,106.85260420000002,4.0
Nasi Goreng Dan Pecel Ayam Mas Rey,4.0,1,"Jl. Pala Raya, Pd. Cabe Udik, Kota Tangerang Selatan",-6.3485153,106.76510859999999,4.0
Nasgor Pak Adi,4.0,1,"Jl. Raya Duta Pelni No.9, RT.4/RW.28, Bakti Jaya, Kota Depok",-6.372956599999998,106.8558283,4.0
Nasi Goreng dan Nasi Uduk Lesehan,4.0,1,"Jl. Akses UI No.7, RW.1, Tugu, Kota Depok",-6.354450099999998,106.83963190000001,4.0
Nasi Banting 2108,4.0,1,"No., Jl. Abdul Wahab No.26, Kedaung, Kota Depok",-6.3616141,106.74832690000001,4.0
Nasi Goreng( Si.bontot) Kelingan-bae,4.0,1,"Jl. Margonda Raya, Pondok Cina, Kota Depok",-6.366794000000001,106.83393490000002,4.0
Nasi goreng pak de,4.0,1,"Cinangka, Depok City",-6.371220099999999,106.76257820000001,4.0
Nasi goreng mas suwardi,4.0,1,"RT.7/RW.11, Pisangan Baru, East Jakarta City",-6.2107328,106.8668055,4.0
Nasi Kampleng,4.0,1,"Jl. H. Syahrin No.5, RT.7/RW.7, Gandaria Utara, Kota Jakarta Selatan",-6.2635847999999985,106.7936761,4.0
Pondok Nasi Goreng,4.0,1,"GF , Lotte Mart Wholesale Pasar Rebo , JL. Lingkar Luar Selatan, Susukan , Ciracas , 13750 Jakarta Timur , DKI Jakarta, RT.7/RW.3, Susukan, East Jakarta City",-6.3097699999999985,106.86745,4.0
Nasi Goreng Sugeng,4.0,1,"Pujasera Melawai Jl. Melawai Xlll, RT.3/RW.1, Melawai, Kota Jakarta Selatan",-6.246336599999999,106.80074270000001,4.0
NASI GORENG 212,4.0,1,"Jl. Panjang Arteri Klp. Dua Raya No.17, RT.6/RW.2, Klp. Dua, Kota Jakarta Barat",-6.204236000000001,106.76966759999999,4.0
Mie Goreng Rebus Bihun Kwetiau,4.0,1,"Jl. Poltangan Raya No.2A, RT.2/RW.4, Tj. Bar., Kota Jakarta Selatan",-6.295603900000001,106.84141129999999,4.0
Nasi Goreng Pinangsia,2.0,2,"Dapur Raya Pasaraya Grande Jalan Sultan Iskandarsyah II Raya Lantai LG #W33, Jakarta Selatan, RT.3/RW.1, Melawai, Kota Jakarta Selatan",-6.244617,106.80240800000001,4.0
Sedap Malam Fried Rice,4.0,1,"Jl. Ciledug Raya No.53, RT.6/RW.4, Petukangan Utara, Kota Jakarta Selatan",-6.236503599999999,106.7580212,4.0
Nasi goreng mba eva,4.0,1,"Jl.holtilkultura deket jl.pisang &, Jl. Jati Raya, RT.7/RW.6, Ps. Minggu, jakarta",-6.2883638999999985,106.8367632,4.0
Nasgor Ayam Special,4.0,1,"Jl. Abuserin No.37, RW.6, Gandaria Sel., Kota Jakarta Selatan",-6.275777799999998,106.79526909999998,4.0
Nasi Goreng Pak'de,4.0,1,"Jl. Bangka Raya No.6, RT.3/RW.5, Pela Mampang, Kota Jakarta Selatan",-6.2435027000000005,106.8161959,4.0
nasigoreng bang nos,4.0,1,"Jl. Kebagusan Raya Gg. Sawo No.5A, RT.10/RW.6, Kebagusan, Kota Jakarta Selatan",-6.3082139999999995,106.82778,4.0
"""Yono Nasi Goreng""",4.0,1,"Jl. H. Sulaiman No.63, RT.1/RW.1, Petukangan Utara, Kota Jakarta Selatan",-6.2352577999999985,106.7454122,4.0
Nasi Goreng,4.0,1,"Jl. Palmerah Barat No.49c, RT.1/RW.15, Palmerah, Kota Jakarta Barat",-6.206678599999999,106.78487009999999,4.0
Nasi Goreng Mesjid Darul,4.0,1,"Jl. Yayasan RPI No.16, RT.8/RW.4, Kuningan Tim., Kota Jakarta Selatan",-6.2284361,106.8334295,4.0
Warung Awy Nasi Goreng,4.0,1,"Depan Gedung FIF Jalan Lebak Bulus 1 Haji Baun Cilandak, RT.5/RW.1, Lb. Bulus, DKI Jakarta",-6.292605,106.782053,4.0
Nasi Goreng Edoy,4.0,1,"Jl. H Barat, RT.7/RW.6, Kb. Baru, Kota Jakarta Selatan",-6.235168199999999,106.8594412,4.0
Nasi Goreng Gatex 979,4.0,1,"RT.10/RW.7, Lebak Bulus, South Jakarta City",-6.290645099999999,106.7751357,4.0
Nasi Goreng Alifah,4.0,1,"Jl. H. Taiman No.23, RT.2/RW.10, Gedong, Kota Jakarta Timur",-6.297675400000001,106.8655088,4.0
Nasi Goreng Gaul Mas Bontot,4.0,1,"Jl. AMD 20 No.7, RT.7/RW.1, Balekambang, Kota Jakarta Timur",-6.2687669,106.85925379999999,4.0
Nasi Goreng Gila,4.0,1,"Jl. Bonjol, Pd. Karya, Kota Tangerang Selatan",-6.267441000000001,106.7396367,4.0
Nasi Goreng 12 Cah Purbalingga,4.0,1,"Jl. Kalimangso No.74A, RT.2/RW.1, Jurang Manggu Tim., Kota Tangerang Selatan",-6.2640654,106.7346254,4.0
Nasi goreng bang Noz,4.0,1,"Jl. Kebagusan Raya No.6A, RT.1/RW.7, Ragunan, Kota Jakarta Selatan",-6.2976915999999985,106.8257136,4.0
Nasi Goreng Mawut,4.0,1,"Jl. Caraka Buana Raya, Pd. Karya, Kota Tangerang Selatan",-6.2505308,106.74078909999999,4.0
Warung Nasi Goreng Mbah Jaroot,4.0,1,"Jl. Batu Ampar No.1, RT.005/RW.5, Cililitan, Kota Jakarta Timur",-6.267309699999998,106.86293559999999,4.0
Nasi Goreng Gila Maa Rudi Gondrong,4.0,1,"Jl. Peninggaran Timur II, RT.6/RW.9, Kby. Lama Utara, Kota Jakarta Selatan",-6.2443363,106.7756976,4.0
WARTEG NASGOR KURNIA,2.0,2,"Jalan H. Dilun No. 6B RT. 002 RW. 005, Ulujami, Pesanggrahan, RT.1/RW.7, Ulujami, Kota Jakarta Selatan",-6.246144,106.76355090000001,4.0
Toge Goreng Samping MJBJ,4.0,1,"Blok, Jl. Bintaro Utara Blok p No.314, Bintaro, South Jakarta City",-6.2717063999999985,106.75099979999999,4.0
"Kantin Ibu Toha, Sedap",4.0,1,"Unnamed Road, RT.4/RW.17, Pd. Pinang, Kota Jakarta Selatan",-6.284041200000001,106.775139,4.0
Nasi Goreng Jangkung,4.0,1,"Jl. Palem VIII No.27, RT.1/RW.8, Petukangan Utara, Kota Jakarta Selatan",-6.2252211,106.7594544,4.0
Nasi Goreng Sari Rasa,4.0,1,"Jl. Ulujami Raya Gg. Kancil No.62, RT.13/RW.4, Ulujami, Kota Jakarta Selatan",-6.2438486,106.7630979,4.0
Babeh Aneka Nasi Goreng,4.0,1,"Kalibata City, Apartemen, Tower Flamboyan No.RT.11, RT.9/RW.4, Kalibata, South Jakarta City",-6.256745700000001,106.85255330000001,4.0
Rice Kabsah Tebet With Chef Ali,3.0,1,"Jl. Tebet Barat II E, RT.4/RW.2, Tebet Bar., Kota Jakarta Selatan",-6.231802500000001,106.8502456,3.0
Nasi Goreng Jampang,3.0,1,"Jl. Meruya Selatan No.8, RT.1/RW.2, Meruya Sel., Kota Jakarta Barat",-6.212750700000001,106.7378013,3.0
Nasi Goreng Mas Zen,3.0,1,"Jl. Batu Ampar V No.RT. 07, RT.9/RW.5, Batu Ampar, Kota Jakarta Timur",-6.2792651,106.86470859999999,3.0
nasi goreng pak miat,3.0,1,"RT.7/RW.6, Duren Tiga, South Jakarta City",-6.2534912,106.8360409,3.0
Nasi goreng seafood & steak Afra,3.0,1,"Gg. Sakinah, Tugu, Kota Depok",-6.3658977,106.84661799999999,3.0
Aneka Nasi Goreng,3.0,1,"Dapur Raya 2 Pasar Raya Blok M Lt LG Jalan Iskandarsyah 2, Jakarta Selatan, RT.3/RW.5, Melawai, Kota Jakarta Selatan",-6.2469470000000005,106.804704,3.0
Nasi Goreng Pakde Jejen,3.0,1,"Jl. Surya Kencana, Pamulang Bar., Kota Tangerang Selatan",-6.348677899999998,106.7346943,3.0
Warung Nasgor Tegal Bidin,3.0,1,"Jl. Raya Cilandak Kko, RT.1/RW.5, Ragunan, Kota Jakarta Selatan",-6.296003199999999,106.8156528,3.0
